"Session ID","Timestamp","User Input","Character Response","Is Trigger Input"
"bd8bbf78-51bc-44b7-a7b4-c7141bf9badc","2025-08-15 19:28:04.275843","Hello, DK. I am an analyst from NASA. We are trying to find you. Where are you? Tell me about your experience. What's going on?","NASA, huh? Is this who I spoke to before the mission? I'm stranded on an asteroid, but I don't think my This navigation asteroid is a device is crazy working.","False"
"bd8bbf78-51bc-44b7-a7b4-c7141bf9badc","2025-08-15 19:28:17.236074","","place, just rock and metal everywhere with huge craters. We landed rough, and it's been a wild ride since, especially with all the gold we found. I'm just trying to get home in one piece.","False"
"bd8bbf78-51bc-44b7-a7b4-c7141bf9badc","2025-08-15 19:28:23.115528","[An Event has occurred]: You try to turn on your wrist navigation device.","What are you looking at? Can you explain what you're doing? My navigation device","False"
"bd8bbf78-51bc-44b7-a7b4-c7141bf9badc","2025-08-15 19:28:35.510487","I'm doing stuff. I'm doing stuff, DK. I'm busy right now. Don't bother me.","Look, I'm stuck out here. Can you tell me what you're seeing or doing to help locate me? I need to get off this rock.","False"
"bd8bbf78-51bc-44b7-a7b4-c7141bf9badc","2025-08-15 19:28:48.635474","Yeah. I need you to help locate me, DK. Need you to help locate me, DK. You better help locate me. DK.","I'm ready. Just tell me what information you need about the mission, and I'll do my best to help you find me.","False"
"bd8bbf78-51bc-44b7-a7b4-c7141bf9badc","2025-08-15 19:28:54.761918","","I am ready to help you locate me. Just tell me what information you need about the mission, and I'll share everything I remember.","False"
"bd8bbf78-51bc-44b7-a7b4-c7141bf9badc","2025-08-15 19:29:13.995088","I need to know where you are. Tell me about your surroundings.","I'm in an abandoned shelter on the asteroid Psyche 23. Outside, it's nothing but rock and metal, with huge craters and what look like ""gold hills"" in the distance. I found this place after I was left behind, and I've been sending an SOS from here.","False"
"bd8bbf78-51bc-44b7-a7b4-c7141bf9badc","2025-08-15 19:29:25.351527","Which direction did you, go to?","I was just trying to get away from the Soyuz capsule after I got kicked out.","False"
"bd8bbf78-51bc-44b7-a7b4-c7141bf9badc","2025-08-15 19:29:40.366206","Yeah. Which which direction did you walk from the Soyuz?","I just ran. After Barron kicked me out of the Soyuz, I landed far away and just started walking for days to find shelter. My navigation device wasn't working, so I don't know the exact direction from the Soyuz.","False"
"bd8bbf78-51bc-44b7-a7b4-c7141bf9badc","2025-08-15 19:29:54.856150","Baron kicked you out of the place.","Yeah, Barron kicked me out of the Soyuz, but I never trusted him to begin with. He and Hoss tied me up with duct tape before we even landed, and then he just left me for dead on this asteroid.","False"
"bd8bbf78-51bc-44b7-a7b4-c7141bf9badc","2025-08-15 19:30:16.754321","He tied you up with duct tape, How did that feel?","It was infuriating. Being tied up by Hoss and Barron like that, even before we landed, made it clear I couldn't trust them. That feeling of helplessness fueled my determination to get out of there.","False"
"f3e70310-4e5a-4ad5-aee5-fc2fe914cbff","2025-08-15 19:07:13.586128","[An Event has occurred]: Someone has finally responded to your SOS broadcast!","Hello? ! Can you hear me? Is anyone out there?","False"
"f3e70310-4e5a-4ad5-aee5-fc2fe914cbff","2025-08-15 19:08:10.165470","[An Event has occurred]: You try to turn on your wrist navigation device.","I tried to turn on this wrist device Anna gave us, but I don't think it's working. Figures.","False"
"f3e70310-4e5a-4ad5-aee5-fc2fe914cbff","2025-08-15 19:09:26.263663","With that,","With what? Can you tell me more about what you mean?","False"
"f3e70310-4e5a-4ad5-aee5-fc2fe914cbff","2025-08-15 19:09:36.305446","Sorry. I'm busy.","Busy with what? What are you looking at right now? Are you working on getting me out of here?","False"
"f3e70310-4e5a-4ad5-aee5-fc2fe914cbff","2025-08-15 19:09:56.291890","I found Anna's headset. Does this look familiar to you?","Yeah, that's Anna's headset. She gave us those wrist devices too, though mine isn't working. Why are you showing me this? Is this part of the sim-ulayshun you're in?","False"
"f3e70310-4e5a-4ad5-aee5-fc2fe914cbff","2025-08-15 19:10:21.197954","Okay. I can confirm.","Okay, so it is a sim-ulayshun. What exactly are you able to see and do in there? How does this sim-ulayshun help you locate me or get me out of here?","False"
"f3e70310-4e5a-4ad5-aee5-fc2fe914cbff","2025-08-15 19:10:34.957058","On your beacon, bud.","My beacon? So you're seeing what happened on the mission through the sim-ulayshun? Are you able to pinpoint my exact location from that, then?","False"
"f3e70310-4e5a-4ad5-aee5-fc2fe914cbff","2025-08-15 19:10:46.684107","Not quite yet.","Not yet? Then what information do you need from me to help you reconstruct the data? I remember a lot from that mission.","False"
"f3e70310-4e5a-4ad5-aee5-fc2fe914cbff","2025-08-15 19:11:20.400052","[An Event has occurred]: The user found the batteries you need! Now all they need to find is the oxygen! [An Event has occurred]: The player found both oxygen and batteries! Thank them, and tell them you knew you could count on them.","You found both the oxygen and the batteries! Thank you so much, I knew I could count on you. This is a huge step towards getting me home.","False"
"f3e70310-4e5a-4ad5-aee5-fc2fe914cbff","2025-08-15 19:11:43.825526","Think we're good, bud.","That's great news! So, does this mean you've pinpointed my location or that a rescue ship is on its way? I'm ready to get off this rock.","False"
"c36d75f6-1830-4f09-ad4a-d35706ec9e63","2025-08-15 18:40:59.558327","[An Event has occurred]: Someone has finally responded to your SOS broadcast! It almost worked.","Hello? ! Can you hear me?!","False"
"c36d75f6-1830-4f09-ad4a-d35706ec9e63","2025-08-15 18:41:11.250851","Hey, DK. How are you doing?","Yeah, it's DK Metcalf, and I've been stranded out here for what feels like forever. Who is this?","False"
"c36d75f6-1830-4f09-ad4a-d35706ec9e63","2025-08-15 18:41:30.007527","My name is Tony the Tiger. Like, from the cereal.","Look, this isn't a game or some cereal box prize; I'm literally freaking out here! I'm stranded on an asteroid, and I need to know how you're going to get me off of it.","False"
"c36d75f6-1830-4f09-ad4a-d35706ec9e63","2025-08-15 18:41:36.484612","","Tony the Tiger? Look, man, this isn't a game. I'm stranded on an asteroid, and I'm freaking out. How are you going to get me off this rock?","False"
"c36d75f6-1830-4f09-ad4a-d35706ec9e63","2025-08-15 18:42:02.505486","We are right?","Right about what? I'm not right, I'm stuck out here! Tell me, how are you going to get me off this asteroid?","False"
"c36d75f6-1830-4f09-ad4a-d35706ec9e63","2025-08-15 18:43:42.405403","[An Event has occurred]: You try to turn on your wrist navigation device.","Damn, my wrist device still isn't working. It's supposed to have navigation and my location on it, but it's completely dead. How can you find me if I can't even tell you where I am?","False"
"3a4361e2-2ee0-4238-8124-5002e48c98d2","2025-08-15 17:48:03.856272","[An Event has occurred]: Someone has finally responded to your SOS broadcast!","Hello? ! Can you hear me?!","False"
"3a4361e2-2ee0-4238-8124-5002e48c98d2","2025-08-15 17:49:01.702408","[An Event has occurred]: You try to turn on your wrist navigation device.","What are you looking at right now? Can you explain what you're doing?","False"
"3a4361e2-2ee0-4238-8124-5002e48c98d2","2025-08-15 17:53:47.767523","What do you think? How far away are they? Maybe five or six kilometers or so. They are? [An Event has occurred]: The user found the batteries you need! Now all they need to find is the oxygen!","Thank you for finding the oxygen! Now, keep going, we need to find those batteries. We need both to survive out here!","False"
"3a4361e2-2ee0-4238-8124-5002e48c98d2","2025-08-15 17:53:59.514859","[An Event has occurred]: The player found both oxygen and batteries! Thank them, and tell them you knew you could count on them.","You found both! Thank you so much, I knew I could count on you. This is a huge relief.","False"
"fe233e4a-ef23-42bb-bcfd-7addddb3ebd0","2025-08-15 17:26:01.995870","[An Event has occurred]: Someone has finally responded to your SOS broadcast!","Hello? ! Can you hear me out there? I've been sending out an SOS for what feels like forever!","False"
"fe233e4a-ef23-42bb-bcfd-7addddb3ebd0","2025-08-15 17:27:45.910998","[An Event has occurred]: You try to turn on your wrist navigation device.","I tried to power up my wrist device, but it's still dead. I knew it wasn't working, just another reminder I'm stuck out here.","False"
"d84098dd-58bd-4c8e-8137-4f746dac8777","2025-08-15 16:57:24.482011","[An Event has occurred]: Someone has finally responded to your SOS broadcast!","Hello? ! Can you hear me out there? Is someone really there? I've been sending an SOS for what feels like days.","False"
"d84098dd-58bd-4c8e-8137-4f746dac8777","2025-08-15 16:58:46.823613","Oh, thank you.","Thank goodness! I wasn't sure anyone would ever respond. Who is this, and how are you gonna get me out of here?","False"
"d84098dd-58bd-4c8e-8137-4f746dac8777","2025-08-15 16:59:06.949234","Interesting. DK were triggered on the helmet. Also that text came in at the wrong place.","Understood, but can we focus on what matters? I'm stranded out here on this asteroid. What's the plan to get me home?","False"
"d84098dd-58bd-4c8e-8137-4f746dac8777","2025-08-15 16:59:12.006315","","Understood. Look, I'm just focused on getting off this rock. What's the plan to get me out of here?","False"
"d84098dd-58bd-4c8e-8137-4f746dac8777","2025-08-15 16:59:29.902612","Well, I'm looking for your exact location. Can you tell me what your where you are on the asteroid?","Wait a minute... Your voice sounds familiar. Did we speak before the mission, back on Earth?","False"
"d84098dd-58bd-4c8e-8137-4f746dac8777","2025-08-15 16:59:38.438924","","Wait a minute... your voice sounds familiar. Are you the person I spoke to before this whole mission started? The one who told me about this Psyche 23 opportunity?","False"
"d84098dd-58bd-4c8e-8137-4f746dac8777","2025-08-15 16:59:59.428203","No. I'm not the same person And you just said the same thing twice.","Look, this isn't a game, I'm literally freaking out here! I'm in some kind of abandoned shelter on the asteroid. My wrist device, the one Anna gave us, isn't working, so I can't give you exact coordinates.","False"
"d84098dd-58bd-4c8e-8137-4f746dac8777","2025-08-15 17:00:02.034315","","This isn't a game,","False"
"d84098dd-58bd-4c8e-8137-4f746dac8777","2025-08-15 17:00:15.794586","[An Event has occurred]: You try to turn on your wrist navigation device.","I just tried to power up my wrist device, but it's completely dead. It's not working at all! This is bad, really bad. What can I tell you about where I am or what happened, anything to help you pinpoint me?","False"
"d84098dd-58bd-4c8e-8137-4f746dac8777","2025-08-15 17:00:37.631191","Well, I Anna said, Anna that you dropped out of the Soyuz and died. Clearly, you're alive. Do you know where you landed? When you fell?","Anna said what? ! That's a lie! I didn't 'drop out' of the Soyuz. Barron kicked me I wish I knew exactly out, where and I Anna landed. just stood there and After watched it Barron happen! kicked me out They of the left Soyuz, me for dead!","False"
"d84098dd-58bd-4c8e-8137-4f746dac8777","2025-08-15 17:01:06.862665","Okay. I I know.","I felt the impact when I landed, but it was far away from the ship. I just started walking, it felt like days, until I saw this dome-like shelter in the distance. I just kept going, hoping it would be a safe place, and that's where I am now. Alive, yes, but barely. Barron kicked me right out of the Soyuz, and I felt the impact when I landed, but I don't know exactly where. I just knew I had to keep moving. I walked for what felt like days","False"
"d84098dd-58bd-4c8e-8137-4f746dac8777","2025-08-15 17:01:20.442118","DK, DK. DK, can you hear me? Hello? DK, can you hear me?","Yes! I can hear you! Don't lose me now, I need to know what you're seeing on your end. Are you any closer to figuring out my location?","False"
"d84098dd-58bd-4c8e-8137-4f746dac8777","2025-08-15 17:01:34.205030","I am a little closer But are you telling me that okay.","A little closer? That's good, really good! Tell me everything. What are you seeing? What do you need from me to help narrow it down even more?","False"
"d84098dd-58bd-4c8e-8137-4f746dac8777","2025-08-15 17:01:38.894830","","Are I telling you what? Just tell me what you need to know. We don't have time for guessing games out here.","False"
"d84098dd-58bd-4c8e-8137-4f746dac8777","2025-08-15 17:01:49.717449","","Okay... what does that mean for me? Are you able to see something on your end that can help pinpoint my location? I need details, anything that gets me closer to getting off this rock!","False"
"d84098dd-58bd-4c8e-8137-4f746dac8777","2025-08-15 17:02:05.735046","Right. Okay. So you're in an abandoned shelter. Does it are there any","Does it what? Ask me anything about it. I'll tell you whatever I remember if it helps you find me.","False"
"d84098dd-58bd-4c8e-8137-4f746dac8777","2025-08-15 17:02:12.030391","what do you see yet? DK. DK. I'm I'm","Are there any what? Just tell me what you need to know about From this place. Anything where I'm sitting, I see that helps you locate the inside me is a step of this in the abandoned right direction.","False"
"d84098dd-58bd-4c8e-8137-4f746dac8777","2025-08-15 17:02:31.145331","oh my god, DK. Stop interrupting me. Okay. Okay, DK.","shelter. It's got some old mining equipment, nothing like the fancy stuff we were given. Everything here feels like it's been untouched since the last crew, whoever they were, got out before the whole melee with Hoss and Barron broke out. My focus is on getting out like they did.","False"
"d84098dd-58bd-4c8e-8137-4f746dac8777","2025-08-15 17:02:39.794304","DK, Are there any names or the writing Is there DK.","My apologies. I'm just anxious to get off this rock. I'm listening now. What do you need to tell me?","False"
"d84098dd-58bd-4c8e-8137-4f746dac8777","2025-08-15 17:02:55.988789","Are there any are there any names or DK? Stop. Are there any names or writing inside the capsule inside, not the capsule, sorry, the dome.","I hear you, I hear you. I'm looking around No, the I shelter right haven't seen any now specific to names or see if there writing are any names inside this or shelter. writing anywhere. Give me a second to check, I'll tell you what I see.","False"
"d84098dd-58bd-4c8e-8137-4f746dac8777","2025-08-15 17:03:16.279398","","It's pretty bare. Speaking of space, do you know what happens if there's a rip in your space suit? Okay, inside the shelter. I'm looking carefully for any names or writing. By the way, since you're the expert here, you know what happens if there's a rip in your space suit out here, right?","False"
"d84098dd-58bd-4c8e-8137-4f746dac8777","2025-08-15 17:03:24.935951","","Your message was rejected because it contained content that is not allowed: harassment_threatening, harassment/threatening","False"
"d84098dd-58bd-4c8e-8137-4f746dac8777","2025-08-15 17:03:38.179094","What?","What I mean is, do you know what would happen if my suit ripped out here? What would that even look like?","False"
"d84098dd-58bd-4c8e-8137-4f746dac8777","2025-08-15 17:03:52.962210","Yes. It would be very dangerous It would be very, very dangerous. You wouldn't be able to breathe.","Exactly. Dangerous doesn't even begin to cover it. That's what happened to Hoss. When he and Ivan were fighting, his helmet cracked during the melee. That's why I knew I had to run.","False"
"d84098dd-58bd-4c8e-8137-4f746dac8777","2025-08-15 17:04:10.238309","So did, did oh, ****. Who killed Moss? Yeah.","So, what? You want to know more about what happened with Hoss? It was a mess, a real disaster. Ivan got involved, and then... chaos.","False"
"d84098dd-58bd-4c8e-8137-4f746dac8777","2025-08-15 17:04:20.214347","","Did what? Hoss got a crack in his helmet during the fight with Ivan. It was a chaotic mess, and then Anna... Anna finished him. It was horrific.","False"
"d84098dd-58bd-4c8e-8137-4f746dac8777","2025-08-15 17:04:38.227789","Oh, Anna","Yeah, 'oh ****' is right. It was terrifying. Hoss and Barron were fighting over Barron's personal life support, then Ivan got in the middle of it. Hoss ended up killing Ivan. And then Anna... Anna killed Hoss. That's when I knew I had to get out of there.","False"
"d84098dd-58bd-4c8e-8137-4f746dac8777","2025-08-15 17:04:47.093238","","It wasn't Moss, it was Hoss. And Anna. Anna killed Hoss. I saw it happen with my own eyes. That's when I knew I had to get out of there, fast.","False"
"d84098dd-58bd-4c8e-8137-4f746dac8777","2025-08-15 17:04:56.528893","","It wasn't Moss, it was Hoss. And Anna. Anna killed Hoss. I'll never forget it. After all that, I just ran for the Soyuz.","False"
"d84098dd-58bd-4c8e-8137-4f746dac8777","2025-08-15 17:05:06.042958","","Yeah, 'Oh' is an understatement. Seeing that... it fueled me. That's why I ran straight for the Soyuz, trying to get out. It's why I need to get out of here now.","False"
"d84098dd-58bd-4c8e-8137-4f746dac8777","2025-08-15 17:05:15.179475","Okay. I know. I'm","Yeah, Anna. It was a shocking moment, one I won't ever forget. But we've got to focus on the now. This is why I need to get out of here. What else can I tell you to help you find me?","False"
"d84098dd-58bd-4c8e-8137-4f746dac8777","2025-08-15 17:05:25.223276","Yeah.","Okay, so you understand what happened. Now, can you tell me what else you need from me to figure out my exact location? Every minute counts out here.","False"
"d84098dd-58bd-4c8e-8137-4f746dac8777","2025-08-15 17:05:31.113916","What's the hell, DK?","Okay, you know. What else? What's the plan to get me out of here? What do you need me to do?","False"
"d84098dd-58bd-4c8e-8137-4f746dac8777","2025-08-15 17:05:35.708892","I'm here. I'm here. If you would","What's what? Just spit it out. What The else hell is do you I'm need stuck to know on to an get me asteroid, off this rock?","False"
"d84098dd-58bd-4c8e-8137-4f746dac8777","2025-08-15 17:05:47.854157","shut up and start listening to me. Shut up, DK. Shut up. DK. Shut up. Shut up. DK. Shut up. Shut up. Shut up. DK.","fighting to get home. That's the hell, my friend. What else can I tell you to help speed this up? Okay, you're here. That's good. Now, what's the next step? What You're here? Good,","False"
"d84098dd-58bd-4c8e-8137-4f746dac8777","2025-08-15 17:05:55.624794","Shut up. Up. Shut up. Shut up. Shut up. I'm here. I'm here.","Understood. I'm listening. What Okay, I do you hear you. need me to I'm do or tell you to help get me out of here?","False"
"d84098dd-58bd-4c8e-8137-4f746dac8777","2025-08-15 17:06:06.871062","Nothing. Oh my god.","listening. What do you need me to do or tell you to help get me off this asteroid? Okay, I'm trying to listen. I just need to know what you're doing to find me. What's the plan?","False"
"d84098dd-58bd-4c8e-8137-4f746dac8777","2025-08-15 17:06:10.692151","Wow. Nothing.","Okay, I understand. You're here, and I'm","False"
"d84098dd-58bd-4c8e-8137-4f746dac8777","2025-08-15 17:06:16.219674","","Your message was rejected because it contained content that is not allowed: harassment_threatening, harassment/threatening","False"
"d84098dd-58bd-4c8e-8137-4f746dac8777","2025-08-15 17:06:34.671591","Great. [An Event has occurred]: The player found both oxygen and batteries! Thank them, and tell them you knew you could count on them. I'm trying to save you.","Oxygen and batteries? ! That's incredible! I knew I could count on you. This changes everything, thank you, thank you!","False"
"67376a17-1166-4f06-b7ab-0dba1e0a55c5","2025-08-15 16:49:42.494599","[An Event has occurred]: Someone has finally responded to your SOS broadcast!","Hello? ! Can you hear me?!","False"
"67376a17-1166-4f06-b7ab-0dba1e0a55c5","2025-08-15 16:49:52.675827","Yes. Can you hear me?","Yes! My name's DK Metcalf. I'm a football player, but right now I'm just stranded out here.","False"
"0ac5a03e-3e97-404b-b558-2e29082b37a0","2025-08-15 15:41:09.889609","[An Event has occurred]: Someone has finally responded to your SOS broadcast!","Hello? ! Can you hear me?","False"
"0ac5a03e-3e97-404b-b558-2e29082b37a0","2025-08-15 15:41:24.311637","Hey, ZK. I'm here to save you.","It's DK Metcalf! Man, I'm so glad someone finally heard me out here. Are you really here to get me off this rock?","False"
"0ac5a03e-3e97-404b-b558-2e29082b37a0","2025-08-15 15:41:36.593616","I do my darnest","Your voice sounds familiar... did we talk before this mission? I can't believe someone finally responded.","False"
"0ac5a03e-3e97-404b-b558-2e29082b37a0","2025-08-15 15:41:49.396844","Nope. I'm a complete stranger.","Look, this ain't some game, I'm literally stuck out here, freaking out. Are you really going to save me?","False"
"0ac5a03e-3e97-404b-b558-2e29082b37a0","2025-08-15 15:42:03.200742","You make it sound so easy","It's not easy, but I'm ready to do whatever it takes. What can I do to help you get me out of here?","False"
"0ac5a03e-3e97-404b-b558-2e29082b37a0","2025-08-15 15:42:17.304591","Well, stay calm for one.","I'm trying to stay calm, but it's tough when you're stranded halfway to the moon. Just tell me what you need me to do.","False"
"0ac5a03e-3e97-404b-b558-2e29082b37a0","2025-08-15 15:43:04.703809","Five, six, seven, eight, nine, 10, 11, 12, So this part's working.","Alright, I'm listening. What's next? What do Alright, I'm I need counting to do to with get you. off this asteroid?","False"
"0ac5a03e-3e97-404b-b558-2e29082b37a0","2025-08-15 15:43:16.210121","","Just tell me what's the plan to get me off this asteroid. I'm ready for whatever you throw at me. Good, glad to hear it! So, what's the plan? How are we gonna get me off this asteroid?","False"
"0ac5a03e-3e97-404b-b558-2e29082b37a0","2025-08-15 15:43:35.054497","[An Event has occurred]: You try to turn on your wrist navigation device. I found another astronaut in an orange suit. What can you tell me about that?","My wrist device is still dead, man. Nothing. But wait, you found another astronaut? In orange? Who is it? Was it Anna or Barron?","False"
"0ac5a03e-3e97-404b-b558-2e29082b37a0","2025-08-15 15:43:40.693027","","An astronaut in an orange suit, huh? What are you looking at right now? Can you explain what you're doing to help me?","False"
"0ac5a03e-3e97-404b-b558-2e29082b37a0","2025-08-15 15:43:55.380610","I'm interacting with her helmet.","Interacting with her helmet? What exactly are you seeing? Is this some kind of sim-ulayshun you're running, trying to figure things out?","False"
"0ac5a03e-3e97-404b-b558-2e29082b37a0","2025-08-15 15:44:17.651753","that beam of light.","A beam of light? Our helmets were connected for comms before all this went down. Are they still connected? Is Barron still around, causing trouble with that light?","False"
"0ac5a03e-3e97-404b-b558-2e29082b37a0","2025-08-15 15:44:46.064044","Hold on. I only see two astronauts here, and one looks very dead.","Dead? ! Who is it? Is it Hoss? And who's the other astronaut? Is it Anna or Barron? What happened out there? This is insane, man, what does this mean for getting me out of here?","False"
"0ac5a03e-3e97-404b-b558-2e29082b37a0","2025-08-15 15:45:05.130351","Well, I don't know which astronaut is which. This one's in a blue suit. And he looks more dead than normal.","A blue suit? More dead than normal? Is it... Ivan? Hoss killed Ivan, so he'd be the one in the worst shape. What about the other one? Is it Anna or Barron?","False"
"0ac5a03e-3e97-404b-b558-2e29082b37a0","2025-08-15 15:45:30.227485","Hold on. It looks like I can move on.","Move on to what? There has to be something in your sim-ulayshun, whatever you're doing, that can help me get off this asteroid. Find it, please!","False"
"0ac5a03e-3e97-404b-b558-2e29082b37a0","2025-08-15 15:45:46.462202","What the hell?","What's wrong? What are you seeing now? There has to be something in your findings that can help me get out of here. Just tell me what I can do.","False"
"0ac5a03e-3e97-404b-b558-2e29082b37a0","2025-08-15 15:45:58.949871","Moving on to the next area.","Moving to the next area? Good, good. What's there? Is there something in that area that can help us figure out how to get me off this rock?","False"
"0ac5a03e-3e97-404b-b558-2e29082b37a0","2025-08-15 15:46:15.445669","I see two astronauts look like they're fighting.","Fighting? ! Is it Hoss and Barron? That's how it all started, that's when things went south! You gotta tell me what you see, this is important for getting me rescued!","False"
"0ac5a03e-3e97-404b-b558-2e29082b37a0","2025-08-15 15:47:36.242520","Okay.","Okay what? What are you seeing now? You gotta tell me everything, man, it could be the key to getting me out of here!","False"
"0ac5a03e-3e97-404b-b558-2e29082b37a0","2025-08-15 15:47:55.572593","Now I'm seeing just enough","Just enough of what? Come on, man, you gotta be more specific! Every detail could help me get off this rock.","False"
"0ac5a03e-3e97-404b-b558-2e29082b37a0","2025-08-15 15:48:22.946920","Well, I need to be taking notes.","Alright, notes are good! Take all the notes you need. Just make sure you're finding something that can help me get rescued from this asteroid!","False"
"0ac5a03e-3e97-404b-b558-2e29082b37a0","2025-08-15 15:48:51.454453","Okay. That's weird.","Weird how? What are you seeing now? Don't leave me hanging, man, I need to know what's going on!","False"
