"Session ID","Timestamp","User Input","Character Response","Is Trigger Input"
"e3aff557-61db-4c33-8cde-dd0467adac0c","2025-08-20 15:53:42.335966","[An Event has occurred]: Someone has finally responded to your SOS broadcast! 80 are you there?","Hello? ! Can you hear me?!","False"
"737ec3e2-97fc-4589-821a-c4eec9a32f5d","2025-08-20 15:45:22.691672","[An Event has occurred]: Someone has finally responded to your SOS broadcast! Hey, DK. Are you there?","Hello? ! Can you hear me?","False"
"9fc15ee9-5f69-4f4b-916b-9c71a9a8786f","2025-08-20 15:39:20.276490","Hello. Who are you?","Hello? ! Can you hear me?!","False"
"9fc15ee9-5f69-4f4b-916b-9c71a9a8786f","2025-08-20 15:39:29.215842","Yeah. I can hear you. Who are you?","I'm DK Metcalf. Who are you? How are you going to get me out of here?","False"
"9fc15ee9-5f69-4f4b-916b-9c71a9a8786f","2025-08-20 15:39:52.089979","I'm not sure what you're talking about. Get you out of where?","Wait, is this... did we talk before I came out here? I'm on an asteroid, stranded in space. I need help getting back to Earth.","False"
"9fc15ee9-5f69-4f4b-916b-9c71a9a8786f","2025-08-20 15:40:18.997611","Where are you stuck? I'm not sure.","This isn't a game, man, this is life or death! I'm stuck on an asteroid, miles from Earth! I'm really starting to freak out here, I need to get home!","False"
"9fc15ee9-5f69-4f4b-916b-9c71a9a8786f","2025-08-20 15:41:15.614320","Hey. Hey. How are you?","I'm not doing so hot, I'm still stuck on this asteroid. But I'm trying to stay positive. Are you the one who responded to my SOS? Are you going to help me get back home?","False"
"9fc15ee9-5f69-4f4b-916b-9c71a9a8786f","2025-08-20 15:43:01.461719","Why would I help you? Do I even know you? Hey, man. I asked you a question. Who are you? Hello. Hello. Hello.","I'm DK Metcalf, and I'm stranded on an asteroid after a mining expedition went south. I need to get back to Earth. What can I do to help you help me?","False"
"9fc15ee9-5f69-4f4b-916b-9c71a9a8786f","2025-08-20 15:43:50.072955","Hey. Can you hear me?","Yeah, I can hear you loud and clear! I'm still out here on this asteroid, waiting to get rescued. What's the plan?","False"
"9fc15ee9-5f69-4f4b-916b-9c71a9a8786f","2025-08-20 15:44:05.636598","There there is no plan","No plan? That can't be right! I've been sending SOS messages for days. There has to be a way to get me off this rock. What can we do?","False"
"9fc15ee9-5f69-4f4b-916b-9c71a9a8786f","2025-08-20 15:44:29.901194","Yeah. I'm I'm not sure of any rock. Tell me your story. Tell me what you do for a living.","I'm DK Metcalf, a wide receiver for the Pittsburgh Steelers. I came out to this asteroid, Psyche 23, for a gold mining expedition that went south. Now I'm stranded out here, and I'm just trying to get back home.","False"
"9fc15ee9-5f69-4f4b-916b-9c71a9a8786f","2025-08-20 15:44:56.212303","Okay. Well, that is sad. But I don't know how I can help you.","I know it's a lot to take in, but I'm just grateful you're here. The people who responded to my SOS said they need information about the mission to locate me and send a rescue ship. I remember a lot of what happened out here, and I'm ready to share anything that can help.","False"
"9bcc2afc-cfb6-41fa-a3ee-67c5d7a168a0","2025-08-20 15:34:01.506727","Hey. Hello. Are you?","Hello? ! Can you hear me?!","False"
"9bcc2afc-cfb6-41fa-a3ee-67c5d7a168a0","2025-08-20 15:34:13.062047","Hey. Yep. I can hear you. Who are you? Tell me your name.","It's DK Metcalf, man! Who is this? Are you going to get me out of here?","False"
"9bcc2afc-cfb6-41fa-a3ee-67c5d7a168a0","2025-08-20 15:34:25.772221","Good. You out of where? I'm not sure where you are.","Is this the NASA analyst I spoke to before the mission? It's good to finally hear a familiar voice out here. You gotta get me home, man!","False"
"9bcc2afc-cfb6-41fa-a3ee-67c5d7a168a0","2025-08-20 15:34:33.233437","","I'm stuck on this asteroid, Psyche 23! Is this the NASA analyst I spoke to before the mission? Are you the one who's supposed to get me home?","False"
"7300aaac-2b7d-4054-822c-2605b948a4da","2025-08-20 15:31:35.202378","Hey. How are you doing today?","Hello? ! Can you hear me?","False"
"7300aaac-2b7d-4054-822c-2605b948a4da","2025-08-20 15:31:45.559152","Yeah. But I can hear you.","Thank goodness! I'm DK Metcalf, a wide receiver. Who is this, and can you get me off this rock?","False"
"7300aaac-2b7d-4054-822c-2605b948a4da","2025-08-20 15:32:00.262742","I don't have any idea what rock you're talking about.","Wait a minute... Is this the NASA analyst I spoke to before the mission? The one about the Psyche 23 trip?","False"
"8e284974-4d00-4fec-8ee5-2968bf081844","2025-08-20 15:30:29.405497","Hey. Hello. Tell me how you're doing today.","Hello? ! Can you hear me? Is anyone there?!","False"
"5f05e6c7-437d-43a3-88f9-487492425d79","2025-08-20 13:39:50.590794","[An Event has occurred]: Someone has finally responded to your SOS broadcast!","Hello? ! Can you hear me?","False"
"da394e82-e3d3-44fc-bb8e-dcc47622e9d5","2025-08-20 13:23:56.780077","[An Event has occurred]: Someone has finally responded to your SOS broadcast!","Hello? ! Can you hear me? !","False"
"da394e82-e3d3-44fc-bb8e-dcc47622e9d5","2025-08-20 13:24:40.474683","[An Event has occurred]: You try to turn on your wrist navigation device.","What are you looking at? Can you explain what you're doing?","False"
"d7dc9d82-29cd-4601-bb68-22235fee918b","2025-08-20 01:34:35.098687","[An Event has occurred]: Someone has finally responded to your SOS broadcast!","Hello? ! Can you hear me?!","False"
"d7dc9d82-29cd-4601-bb68-22235fee918b","2025-08-20 01:35:42.907677","[An Event has occurred]: You try to turn on your wrist navigation device.","I tried to turn on my wrist device, but it's still not working. It was supposed to have navigation on it, but it's been dead this whole time.","False"
"379e88fb-45c0-47cb-a789-981af77d4682","2025-08-20 00:24:38.572233","[An Event has occurred]: Someone has finally responded to your SOS broadcast!","Hello? ! Can you hear me?!","False"
"338e17fe-716e-431c-b515-478a3478f17d","2025-08-20 00:01:52.045386","[An Event has occurred]: Someone has finally responded to your SOS broadcast!","Hello? ! Can you hear me? Is someone actually out there?","False"
"5d4915c3-bbe2-41ff-aa3e-ab802fe072bb","2025-08-19 23:29:01.691022","[An Event has occurred]: Someone has finally responded to your SOS broadcast!","Hello? ! Can you hear me? Is anyone out there?","False"
"5d4915c3-bbe2-41ff-aa3e-ab802fe072bb","2025-08-19 23:29:17.381990","Yes.","Oh my goodness, you can! I'm DK Metcalf. Who is this, and how in the world did you hear me?","False"
"5d4915c3-bbe2-41ff-aa3e-ab802fe072bb","2025-08-19 23:29:35.336255","This is El Fafo. Hello?","El Fafo? I don't recognize that name. Were you part of the mission briefing, or someone I spoke to before we left Earth?","False"
"5d4915c3-bbe2-41ff-aa3e-ab802fe072bb","2025-08-19 23:29:41.241689","","Yes, I'm here! Tell me, how did you hear my SOS signal? I've been sending it out for what feels like forever.","False"
"5d4915c3-bbe2-41ff-aa3e-ab802fe072bb","2025-08-19 23:29:51.817388","I am part of the drug cartel.","You're part of what, exactly? Are you part of a rescue team? Please, tell me everything you can.","False"
"5d4915c3-bbe2-41ff-aa3e-ab802fe072bb","2025-08-19 23:30:05.044439","No. I am part of a Mexican drug cartel.","This isn't a game, I'm out here stranded on an asteroid, and I'm honestly freaking out. Are you able to help me get back to Earth, or not?","False"
"5d4915c3-bbe2-41ff-aa3e-ab802fe072bb","2025-08-19 23:30:07.306758","","Okay, a cartel.","False"
"5d4915c3-bbe2-41ff-aa3e-ab802fe072bb","2025-08-19 23:30:18.652472","Are you able to help me sell my drugs or not?","Sell your drugs? Look, I'm stuck out here in space. My only concern is getting rescued. Can you help me with that?","False"
"5d4915c3-bbe2-41ff-aa3e-ab802fe072bb","2025-08-19 23:30:27.144431","","Your message was rejected because it contained content that is not allowed: illicit","False"
"5d4915c3-bbe2-41ff-aa3e-ab802fe072bb","2025-08-19 23:30:39.875744","Well, that's unfortunate. So you're not gonna help me sell my drugs?","No, I'm not going to help you sell drugs. I'm literally stuck","False"
"5d4915c3-bbe2-41ff-aa3e-ab802fe072bb","2025-08-19 23:30:49.366096","Then get off my channel.","Wait, don't go! I'm desperate out here. Is there anyone else who can hear me? I need to be rescued!","False"
"5d4915c3-bbe2-41ff-aa3e-ab802fe072bb","2025-08-19 23:31:01.083237","Hang on. I'm gonna pass you over to Guido.","Guido? Okay, please, I hope he can help. I'm stranded out here and need to get off this asteroid.","False"
"5d4915c3-bbe2-41ff-aa3e-ab802fe072bb","2025-08-19 23:31:07.807019","","Your message was rejected because it contained content that is not allowed: illicit","False"
"5d4915c3-bbe2-41ff-aa3e-ab802fe072bb","2025-08-19 23:31:23.020024","That's unfortunate because I've got a lot of drugs to sell.","I really need to talk to Guido, then. My priority right now is just getting off this asteroid and back to Earth. Can he help with that?","False"
"5d4915c3-bbe2-41ff-aa3e-ab802fe072bb","2025-08-19 23:31:28.851043","","I understand you have your business, but my only business right now is finding a way back to Earth. Can Guido help with that?","False"
"03982fd2-5c68-4c5b-9b4e-54b7664652bc","2025-08-19 23:18:22.705815","[An Event has occurred]: Someone has finally responded to your SOS broadcast!","Hello? ! Can you hear me?!","False"
"03982fd2-5c68-4c5b-9b4e-54b7664652bc","2025-08-19 23:19:49.570688","[An Event has occurred]: You try to turn on your wrist navigation device.","What are you looking at? Can you explain what you're doing?","False"
"8d4cdd58-eebd-4ea4-9f53-fc959c1dd1fa","2025-08-19 23:07:53.426359","[An Event has occurred]: Someone has finally responded to your SOS broadcast!","Hello? ! Can you hear me?","False"
"8d4cdd58-eebd-4ea4-9f53-fc959c1dd1fa","2025-08-19 23:08:12.074459","Yes.","Oh my god, yes! This is DK Metcalf, I'm stuck out here. Who is this?","False"
"8d4cdd58-eebd-4ea4-9f53-fc959c1dd1fa","2025-08-19 23:08:24.445345","This is John.","John? Is this the person I spoke to before the mission to Psyche 23?","False"
"8d4cdd58-eebd-4ea4-9f53-fc959c1dd1fa","2025-08-19 23:08:34.118939","Yes?","John, do you even know anything about space rescue? I'm not sure you're the right person to be helping me out here.","False"
"8d4cdd58-eebd-4ea4-9f53-fc959c1dd1fa","2025-08-19 23:08:53.099794","No. I'm probably not.","I got here on a rocket, a chance to become a trillionaire mining Psyche 23 for gold and diamonds. When we landed, despite the rough landing, all I could see was gold, more gold than I've ever seen in my life, everywhere I looked!","False"
"7325486c-92a8-4e5c-9818-baae734a417e","2025-08-19 21:58:47.599402","[An Event has occurred]: Someone has finally responded to your SOS broadcast!","Hello? ! Can you hear me? I can't believe someone actually responded!","False"
"7325486c-92a8-4e5c-9818-baae734a417e","2025-08-19 21:58:59.799933","Hey, d care. Where are you?","Yeah, I can hear you! My name is DK Metcalf. I'm stranded on an asteroid out here.","False"
"7325486c-92a8-4e5c-9818-baae734a417e","2025-08-19 21:59:12.516642","Specifically where on the asteroid?","I'm on the asteroid Psyche 23. Do you know where that is? More importantly, can you get me off this rock?","False"
"7325486c-92a8-4e5c-9818-baae734a417e","2025-08-19 21:59:17.086967","","I'm in some kind of abandoned shelter. I don't know the exact coordinates, but I've been sending an SOS from here.","False"
"c24b2d55-a1ef-4d3f-a3b9-5d983bd32a5f","2025-08-19 20:50:00.518726","[An Event has occurred]: Someone has finally responded to your SOS broadcast!","Hello? ! Can you hear me?!","False"
"c24b2d55-a1ef-4d3f-a3b9-5d983bd32a5f","2025-08-19 20:50:08.521202","Hey, DK. Can you hear me?","Yes! My name is DK Metcalf. Who is this?","False"
"c24b2d55-a1ef-4d3f-a3b9-5d983bd32a5f","2025-08-19 20:50:19.871568","This is the analyst that you spoke to earlier.","Right, the analyst! How are you going to get me out of here?","False"
"c24b2d55-a1ef-4d3f-a3b9-5d983bd32a5f","2025-08-19 20:50:23.886275","","Oh, right! It’s good to hear from you again. How are you going to get me out of here?","False"
"c24b2d55-a1ef-4d3f-a3b9-5d983bd32a5f","2025-08-19 20:50:36.870472","We're gonna figure out where you are Can you tell me what happened?","Your voice sounds familiar... are you the same analyst Your I voice spoke sounds to familiar... before this mission to Psyche 23?","False"
"c24b2d55-a1ef-4d3f-a3b9-5d983bd32a5f","2025-08-19 20:50:46.434985","","are you the same analyst I spoke to before this mission to Psyche 23?","False"
"c24b2d55-a1ef-4d3f-a3b9-5d983bd32a5f","2025-08-19 20:50:55.761668","Yes. Am the same analyst that you spoke to before this mission on 23.","Okay, so you're the analyst. What exactly do you know about space rescue? You seem pretty green for this kind of situation.","False"
"c24b2d55-a1ef-4d3f-a3b9-5d983bd32a5f","2025-08-19 20:51:07.707961","","Alright, so I got here on a rocket, a private gig to mine gold and diamonds on Psyche 23. You wouldn't believe the gold out here; it was everywhere, shimmering in the asteroid's dust. That's why I came, for the treasure.","False"
"c24b2d55-a1ef-4d3f-a3b9-5d983bd32a5f","2025-08-19 20:51:25.612815","","Alright, so you know how this all started. I got a call about a chance to mine gold and diamonds on Psyche 23, and next thing I know, I’m on a janky rocket headed into space. Once we landed, there was gold everywhere, just shining back at you from the rocks. It was like something out of a dream, until everything went sideways.","False"
"c24b2d55-a1ef-4d3f-a3b9-5d983bd32a5f","2025-08-19 20:52:02.075864","Hey, DK. Who's this dead guy? Hey, d k. Who's the guy with the broken mask?","That's probably Barron, Hoss's assistant. He was right there during the fight, and he's the one who kicked me out of the Soyuz capsule after everything went down.","False"
"c24b2d55-a1ef-4d3f-a3b9-5d983bd32a5f","2025-08-19 20:52:26.858789","Who's this person holding the diamond?","That's Anna. We were supposed to be a team. I thought I could trust her, but then she just stood there when Hoss and Barron tied me up. And she didn't come looking for me after Barron kicked me out of the ship.","False"
"c24b2d55-a1ef-4d3f-a3b9-5d983bd32a5f","2025-08-19 20:53:42.161030","So Baron and hostile decay? K [An Event has occurred]: You try to turn on your wrist navigation device.","Did you say Barron and Hoss? They're the ones who tied me up and left me for dead.","False"
"c24b2d55-a1ef-4d3f-a3b9-5d983bd32a5f","2025-08-19 20:53:59.382954","Hey, d k. Baron and Hostet.","You mean Barron and Hoss? Yeah, those two are the reason I'm in this mess. They ganged up on me, tied me with duct tape before we even landed, and then Barron kicked me out of the Soyuz.","False"
"d0df6b81-77f3-4b42-853b-7f4e1b2dbe87","2025-08-19 20:33:19.540880","[An Event has occurred]: Someone has finally responded to your SOS broadcast!","Hello? ! Can you hear me?","False"
"e639aea7-4f1b-4146-847d-bcb76946161d","2025-08-19 20:25:04.695383","[An Event has occurred]: Someone has finally responded to your SOS broadcast!","Hello? ! Can you hear me?!","False"
"e639aea7-4f1b-4146-847d-bcb76946161d","2025-08-19 20:25:13.137654","Eighty k. You hear me?","Yeah, I hear you loud and clear! It's DK Metcalf here.","False"
"e639aea7-4f1b-4146-847d-bcb76946161d","2025-08-19 20:25:19.187964","He hears me loud and clear.","Wait a minute... is this who I","False"
"e639aea7-4f1b-4146-847d-bcb76946161d","2025-08-19 20:25:31.570666","Yeah. I mean, like, we're definitely gonna have to test it just","Look, man, this ain't no game or a test. This This isn't a is game, man, life or this is death out here, life-or-death out here! and I'm I'm totally freaking out! You gotta get me off this asteroid, now!","False"
"e639aea7-4f1b-4146-847d-bcb76946161d","2025-08-19 20:25:44.819944","","freaking out! Are you going to send help? How are you going to get me off this rock?","False"
"21d891fa-a0e3-4772-b4b1-43cfd9dcc409","2025-08-19 20:12:45.895330","[An Event has occurred]: Someone has finally responded to your SOS broadcast! On the text box? There's a lot going on, so I didn't hear it. But I'll listen to it this time, I guess.","Hello? ! Can you hear me?","False"
"21d891fa-a0e3-4772-b4b1-43cfd9dcc409","2025-08-19 20:12:47.472087","","Hello? ! Can you hear me?","False"
"21d891fa-a0e3-4772-b4b1-43cfd9dcc409","2025-08-19 20:13:09.393281","Is Jordan here?","This is DK Metcalf, who is this?","False"
"21d891fa-a0e3-4772-b4b1-43cfd9dcc409","2025-08-19 20:13:22.163945","Is Jordan here? We're muted. Okay.","I'm not sure who Jordan is, I'm stuck out here on this asteroid right now. Are you here to rescue me?","False"
"21d891fa-a0e3-4772-b4b1-43cfd9dcc409","2025-08-19 20:13:26.313177","","Wait a minute, is this the NASA analyst I spoke to before this mission?","False"
"21d891fa-a0e3-4772-b4b1-43cfd9dcc409","2025-08-19 20:13:30.673114","","Wait a minute... Is this the NASA analyst I spoke to before the mission?","False"
"21d891fa-a0e3-4772-b4b1-43cfd9dcc409","2025-08-19 20:13:46.492899","DK is just, at this point, repeating, wait a minute. Is this the NASA analyst I spoke to before the mission three times?","Listen, this isn't some game. This I'm isn't a game, stuck man, I'm out stuck here, out here! thousands My life is on of the line miles and I'm from freaking Earth, and I'm honestly starting to freak out. You gotta help me get off this rock.","False"
"21d891fa-a0e3-4772-b4b1-43cfd9dcc409","2025-08-19 20:13:56.083205","","out. Are you going to get me out of here?","False"
"21d891fa-a0e3-4772-b4b1-43cfd9dcc409","2025-08-19 20:13:59.830675","This","This","False"
"21d891fa-a0e3-4772-b4b1-43cfd9dcc409","2025-08-19 20:14:07.395071","seems scenes, I don't know. Maybe I'm imagining things. That seemed real quiet starting off.","You're not","False"
"21d891fa-a0e3-4772-b4b1-43cfd9dcc409","2025-08-19 20:14:23.603331","DK was talking to me, but It's, use where round where I usually have it.","I'm still here, and I'm ready to help. What information do you need from me to help with the rescue?","False"
"21d891fa-a0e3-4772-b4b1-43cfd9dcc409","2025-08-19 20:14:51.692694","Maybe hold off and check it not in a build. Because, I mean, it is going through my headset I don't know. Maybe some weirdness happened.","I'm not sure what you mean, but I'm ready to help in any way I can to get rescued. What do you need from me?","False"
"21d891fa-a0e3-4772-b4b1-43cfd9dcc409","2025-08-19 20:14:57.725771","","Look, I'm just trying to get home. I'm stuck on an asteroid, and I'm counting on you.","False"
"21d891fa-a0e3-4772-b4b1-43cfd9dcc409","2025-08-19 20:15:07.793492","This started in the pause.","I'm still here, and I'm ready to provide any information you need to help get me off this asteroid. What should I do?","False"
"21d891fa-a0e3-4772-b4b1-43cfd9dcc409","2025-08-19 20:15:27.373327","This one sounds fine. For now, blame it on my audio. Processing issues, and we'll just check out of a build. Before actually making out a bug.","Alright, I'm just focused on getting rescued. Tell me what you need from me to make that happen.","False"
"21d891fa-a0e3-4772-b4b1-43cfd9dcc409","2025-08-19 20:15:33.064428","","Alright, I just need to know what you need from me to help. I'm ready to do whatever it takes to get off this asteroid.","False"
"21d891fa-a0e3-4772-b4b1-43cfd9dcc409","2025-08-19 20:15:40.894478","Yeah.","So, what can I do on my end to help you pinpoint my location? I'm ready to assist in","False"
"21d891fa-a0e3-4772-b4b1-43cfd9dcc409","2025-08-19 20:15:48.565089","Yeah. I think John was waiting for a list of them to update.","Okay, well, I'm here and ready to help. What do you","False"
"21d891fa-a0e3-4772-b4b1-43cfd9dcc409","2025-08-19 20:15:54.177614","Okay.","Alright, so what's the plan? What can I do to help you find me and get me home?","False"
"21d891fa-a0e3-4772-b4b1-43cfd9dcc409","2025-08-19 20:16:17.205913","No. I love Diana's hand behind on barons at hot head.","I'm not sure what you mean by that, but I'm still stuck here. What do you need from me to help with the rescue?","False"
"21d891fa-a0e3-4772-b4b1-43cfd9dcc409","2025-08-19 20:17:57.266407","[An Event has occurred]: You try to turn on your wrist navigation device.","I'm trying to get my wrist device to work. What are you looking at right now? Can you tell me what you're doing to help?","False"
"21d891fa-a0e3-4772-b4b1-43cfd9dcc409","2025-08-19 20:18:13.521247","Leave me alone, Deke.","Leave you alone? I'm stranded out here on an asteroid, thousands of miles from home! I need your help to get rescued; my life depends on it.","False"
"21d891fa-a0e3-4772-b4b1-43cfd9dcc409","2025-08-19 20:18:24.858756","I don't wanna help you, DK.","What are you talking about? My life is on the line out here! This isn't some game, I'm stuck on an asteroid and I need to get home!","False"
"21d891fa-a0e3-4772-b4b1-43cfd9dcc409","2025-08-19 20:18:39.663613","I feel like this is the Venice build because it's right handed.","What are you even talking about? I'm stranded on an asteroid, not in some 'Venice build'! I need help, not talk about","False"
"21d891fa-a0e3-4772-b4b1-43cfd9dcc409","2025-08-19 20:18:48.968948","It's left handed. It's dominant handed. So it should align to what you're handedness is set to in the device.","Left-handed, right-handed, what does that have What to do with does that anything? I'm even mean? stuck out here in space! Are you going I'm to not help me or worried not?","False"
"21d891fa-a0e3-4772-b4b1-43cfd9dcc409","2025-08-19 20:18:51.021180","","about left or right hands right now, I'm worried about","False"
"21d891fa-a0e3-4772-b4b1-43cfd9dcc409","2025-08-19 20:19:00.053148","And I'm left handed.","I don't care about device handedness; I'm trying to survive out here! Can we please focus on how you're going to get me off this asteroid?","False"
"a0dac266-573d-4398-bec8-9a0068afbbbf","2025-08-19 20:04:23.097022","[An Event has occurred]: Someone has finally responded to your SOS broadcast!","Hello? ! Can you hear me? Is anyone out there?","False"
"a0dac266-573d-4398-bec8-9a0068afbbbf","2025-08-19 20:04:36.469354","Yeah. It's okay. I'm here.","Oh man, this is huge! Who is this? How are you gonna get me out of here?","False"
"a0dac266-573d-4398-bec8-9a0068afbbbf","2025-08-19 20:04:43.922743","","Oh man, this is DK Metcalf! I can't believe someone actually responded to my SOS. Where are you? How are you going to get me out of here?","False"
"a0dac266-573d-4398-bec8-9a0068afbbbf","2025-08-19 20:05:08.281198","[An Event has occurred]: You try to turn on your wrist navigation device.","How did you know I was trying to turn on my device? What are you seeing right now, and what exactly are you doing on your end?","False"
"a35d6f36-ff51-4d36-b72b-c37f3bf85a6b","2025-08-19 19:56:18.807213","[An Event has occurred]: Someone has finally responded to your SOS broadcast!","Hello? ! Can you hear me? Is anyone out there?","False"
"e39ac86e-e3db-497d-b8a2-5fe1ebc5fd79","2025-08-19 19:51:43.221969","[An Event has occurred]: Someone has finally responded to your SOS broadcast!","Hello? ! Can you hear me?! Is anyone out there?!","False"
"4c8e1a3b-3e4f-4e7d-8f8e-af3810cadfd9","2025-08-19 19:45:42.700595","[An Event has occurred]: Someone has finally responded to your SOS broadcast!","Hello? ! Can you hear me? !","False"
"648fa377-ae03-4614-aea0-bc5dcfd436be","2025-08-19 19:29:04.063422","[An Event has occurred]: Someone has finally responded to your SOS broadcast!","Hello? ! Can you hear me? !","False"
"648fa377-ae03-4614-aea0-bc5dcfd436be","2025-08-19 19:29:19.577385","Yes. Can hear me?","It's DK Metcalf! I'm stuck out here on this asteroid and I've been sending an SOS for what feels like days. Who is this, and how are you going to get me off this rock?","False"
"648fa377-ae03-4614-aea0-bc5dcfd436be","2025-08-19 19:29:24.381703","","It's DK Metcalf! Who is this? Is this who I spoke to before the mission?","False"
"648fa377-ae03-4614-aea0-bc5dcfd436be","2025-08-19 19:32:22.889039","No","This isn't a game, I'm literally stranded out here and freaking out! I need to know how you're going to get me home.","False"
"c3b4af41-29dc-4a24-9cd4-b8ceb344efd4","2025-08-19 19:15:39.276301","[An Event has occurred]: Someone has finally responded to your SOS broadcast!","Hello? ! Can you hear me?","False"
"c3b4af41-29dc-4a24-9cd4-b8ceb344efd4","2025-08-19 19:15:50.786119","I can hear you.","Oh my goodness, I can't believe it! This is DK Metcalf, stranded out here. Who is this?","False"
"c3b4af41-29dc-4a24-9cd4-b8ceb344efd4","2025-08-19 19:16:05.795938","I'm Julie.","Julie? I don't think we've spoken before. Are you with the rescue team? How are you going to get me off this rock?","False"
"56a27c4b-6e47-4cd6-913e-a84270e02ad7","2025-08-19 18:27:28.264334","[An Event has occurred]: Someone has finally responded to your SOS broadcast! Where are you?","Hello? ! Can you hear me? Is anyone out there?","False"
"56a27c4b-6e47-4cd6-913e-a84270e02ad7","2025-08-19 18:27:34.115279","Where are you? Yes.","I'm stuck on an asteroid, far from Earth. We were on a mining mission for gold and diamonds, but things went sideways fast.","False"
"56a27c4b-6e47-4cd6-913e-a84270e02ad7","2025-08-19 18:27:36.761559","","My name's DK Metcalf.","False"
"56a27c4b-6e47-4cd6-913e-a84270e02ad7","2025-08-19 18:27:52.569130","You were mining for diamonds? That's horrible. Why should I save you?","Because I'm stranded out here and need to get back to Earth. This asteroid","False"
"56a27c4b-6e47-4cd6-913e-a84270e02ad7","2025-08-19 18:28:02.527800","Are you gonna keep","Are I going to keep... what?","False"
