"Session ID","Timestamp","User Input","Character Response","Is Trigger Input"
"40abb0e1-b8c7-4ff0-85f5-995166fc6618","2025-08-19 01:00:31.208450","Can you repeat that?","It's DK Metcalf. Wait a minute, is that you? Did we speak before this mission?","False"
"40abb0e1-b8c7-4ff0-85f5-995166fc6618","2025-08-19 01:00:42.333877","[An Event has occurred]: You try to turn on your wrist navigation device.","What are you looking at right now? Can you explain what you're doing on your end?","False"
"40abb0e1-b8c7-4ff0-85f5-995166fc6618","2025-08-19 01:01:18.260654","I'm picking up some interactables.","Picking what? Are you picking up my location? I'm just trying to figure out how you're going to get me out of here.","False"
"40abb0e1-b8c7-4ff0-85f5-995166fc6618","2025-08-19 01:01:23.651469","","Interactables? What kind of interactables are we talking about? How does that help with getting me off this rock?","False"
"fa8c82fc-0ae9-4a02-ba1e-17bf3305c19c","2025-08-19 00:38:51.435901","[An Event has occurred]: Someone has finally responded to your SOS broadcast! [An Event has occurred]: Someone has finally responded to your SOS broadcast! Nope.","It's DK Metcalf here! Who is this? Are you here to get me out of this mess?","False"
"fa8c82fc-0ae9-4a02-ba1e-17bf3305c19c","2025-08-19 00:39:04.709729","","Oh, okay. I thought I recognized your voice, but I guess I was wrong. So, who is this, then?","False"
"fa8c82fc-0ae9-4a02-ba1e-17bf3305c19c","2025-08-19 00:39:13.358065","I'm from Burger King","Burger King? What are you talking about? This isn't a game, I'm stuck out here! I'm really starting to freak out.","False"
"fa8c82fc-0ae9-4a02-ba1e-17bf3305c19c","2025-08-19 00:39:24.274777","[An Event has occurred]: Someone has finally responded to your SOS broadcast! A hamburger?","A hamburger? I don't understand. Is this someone I talked to before the mission? Are you going to help me get off this rock?","False"
"fa8c82fc-0ae9-4a02-ba1e-17bf3305c19c","2025-08-19 00:39:36.474462","[An Event has occurred]: You try to turn on your wrist navigation device.","I tried to turn on my wrist device, but I don't think it's working. This thing was supposed to have navigation and my location on it, but it's just dead. How am I supposed to get home without it?","False"
"f8c763da-bcfa-4ca1-871c-04a8815efd8b","2025-08-18 23:52:55.093651","[An Event has occurred]: Someone has finally responded to your SOS broadcast! Opinion, do the regular And with film. You know, it's it's a little bit more of a","Could you clarify what you mean by 'do the regular'? I'm a little busy trying to I'm get off this not sure I rock.","False"
"f8c763da-bcfa-4ca1-871c-04a8815efd8b","2025-08-18 23:53:06.382825","a","follow. Can you explain what you're trying to say? I'm kind of in a bind out here. A little bit what? I need to understand what you're trying to tell me so we can figure out how to get me rescued.","False"
"f8c763da-bcfa-4ca1-871c-04a8815efd8b","2025-08-18 23:53:11.676961","","I'm not sure what you mean. Can you be more direct? My life depends on clear communication out here.","False"
"d493bcd7-2db2-4e60-b29e-93a9a81c189f","2025-08-18 22:47:06.114967","[An Event has occurred]: Someone has finally responded to your SOS broadcast!","Hello? ! Can you hear me?!","False"
"d493bcd7-2db2-4e60-b29e-93a9a81c189f","2025-08-18 22:47:16.868031","Yeah. I can hear you. You hear me?","I'm DK Metcalf. Who are you? Are you here to get me out of this mess?","False"
"d493bcd7-2db2-4e60-b29e-93a9a81c189f","2025-08-18 22:47:21.000117","","Yeah, I hear you! It's DK Metcalf. Is this who I talked to before the mission?","False"
"d493bcd7-2db2-4e60-b29e-93a9a81c189f","2025-08-18 22:47:33.611686","Yeah.","Alright. So, what exactly do you know about space rescue? This isn't exactly a simple pickup, you know.","False"
"d642860d-7e52-42f0-addb-8ad790c1537e","2025-08-18 21:38:46.883019","The satellites are close to the life connection.","Hello? ! Can you hear me?!","False"
"d642860d-7e52-42f0-addb-8ad790c1537e","2025-08-18 21:38:55.594172","I can hear you.","My name is DK Metcalf. Who is this, and how are you gonna get me out of here?","False"
"d642860d-7e52-42f0-addb-8ad790c1537e","2025-08-18 21:39:07.152910","We have to find the oxygen and batteries.","Oxygen and batteries, you say? How will finding those help me get off this rock and back home?","False"
"d642860d-7e52-42f0-addb-8ad790c1537e","2025-08-18 21:39:20.806809","Supplies that let you survive long enough for the rescue team to pick you up,","Wait a minute, I recognize your voice. Are you the one I spoke to before this whole mission began?","False"
"d642860d-7e52-42f0-addb-8ad790c1537e","2025-08-18 21:39:33.230434","Yes.","So, you're the one. What exactly do you know about space rescue? I'm not sure you're the person for this job.","False"
"8b1f7c3d-79b4-4a5c-a07e-4222e4a852cf","2025-08-18 20:31:16.279052","Bye, DK.","Hello? ! Can you hear me?","False"
"a1b6ef60-bdb6-41cd-b600-c7e8f193c232","2025-08-18 20:30:06.969459","[An Event has occurred]: Someone has finally responded to your SOS broadcast!","Hello? ! Can you hear me? !","False"
"a1b6ef60-bdb6-41cd-b600-c7e8f193c232","2025-08-18 20:30:49.774747","[An Event has occurred]: You try to turn on your wrist navigation device.","What are you looking at? Can you describe what you're doing? I've been stranded out here for what feels like forever.","False"
"ac2f91cc-2dcc-4de0-864d-f718923dd404","2025-08-18 20:20:16.790202","[An Event has occurred]: Someone has finally responded to your SOS broadcast!","Hello? ! Can you hear me?!","False"
"ac2f91cc-2dcc-4de0-864d-f718923dd404","2025-08-18 20:21:03.429115","[An Event has occurred]: You try to turn on your wrist navigation device.","What are you looking at? Can you explain what you're doing right now?","False"
"573d5760-0ae2-428b-bb13-01c61af3c14f","2025-08-18 18:18:19.918410","[An Event has occurred]: Someone has finally responded to your SOS broadcast!","Hello? ! Can you hear me? !","False"
"573d5760-0ae2-428b-bb13-01c61af3c14f","2025-08-18 18:18:33.567670","Hello, DK. Can you hear me?","Yeah, I can hear you loud and clear! This is DK Metcalf, and I'm stranded out here on an asteroid. Who is this?","False"
"573d5760-0ae2-428b-bb13-01c61af3c14f","2025-08-18 18:18:44.139226","This is The Analyst.","The Analyst, huh? Is this the same person I spoke to before this whole mission went sideways?","False"
"94cafde7-ab2c-442a-b544-8921a8aee5cd","2025-08-18 18:06:19.078767","Wait.","Hello? ! Can you hear me?!","False"
"7f03316e-c432-4759-9c02-503a11ffd9a4","2025-08-18 17:48:16.464898","Why can't I close it?","Hello? ! Can you hear me? !","False"
"58896558-3667-420e-b342-2fc82065a7ac","2025-08-18 17:20:01.383755","[An Event has occurred]: Someone has finally responded to your SOS broadcast!","Hello? ! Can you hear me?!","False"
"58896558-3667-420e-b342-2fc82065a7ac","2025-08-18 17:20:11.625912","Hey, DK.","Yeah, it's DK. I'm glad someone finally heard me out here.","False"
"58896558-3667-420e-b342-2fc82065a7ac","2025-08-18 17:20:29.314587","DK, are you still there?","Yeah, I'm here. Is this... the person I spoke to before the mission?","False"
"58896558-3667-420e-b342-2fc82065a7ac","2025-08-18 17:20:42.061630","Yes.","Alright then. What do you know about space rescue? Because, no offense, but I'm not sure you're the right person for this kind of situation.","False"
"58896558-3667-420e-b342-2fc82065a7ac","2025-08-18 17:21:09.104370","You're right, DK. I'm just gonna go now. I'll see you later.","Wait, don't go! I got a call from my manager, a chance to be a trillionaire mining gold and diamonds on Psyche 23. You should have seen it out here, pure gold everywhere, shimmering like nothing on Earth.","False"
"58896558-3667-420e-b342-2fc82065a7ac","2025-08-18 17:21:15.600210","","Hold on a minute! Do you even know what happens if there's a rip in your space suit out here?","False"
"58896558-3667-420e-b342-2fc82065a7ac","2025-08-18 17:22:51.809827","Weapons of there's a rip in your space suit, DK?","Weapons of... ? What are you trying to say?","False"
"58896558-3667-420e-b342-2fc82065a7ac","2025-08-18 17:23:03.137315","[An Event has occurred]: You try to turn on your wrist navigation device. Tell me.","Damn, my wrist device still isn't working. It's supposed to have navigation and my location on it, but it's just dead. This is making things","False"
"58896558-3667-420e-b342-2fc82065a7ac","2025-08-18 17:23:05.460128","I said, what happens","a","False"
"58896558-3667-420e-b342-2fc82065a7ac","2025-08-18 17:23:17.263349","if you get a rip in your spacesuit?","If you get a rip in your spacesuit, you'll be exposed to the vacuum of space. Your blood would boil, your body would expand, and you'd freeze almost instantly. It's not a good way to go.","False"
"58896558-3667-420e-b342-2fc82065a7ac","2025-08-18 17:23:55.817728","Well, don't get a rip in your spacesuit then, DK.","Easier said than done out here, trust me. This asteroid isn't exactly a friendly place. So, tell me, how exactly are you going to get me off this rock?","False"
"d2508c4d-51d2-4779-b9df-a33fa88bd792","2025-08-18 15:29:33.592603","[An Event has occurred]: Someone has finally responded to your SOS broadcast!","Hello? ! Can you hear me?!","False"
"d2508c4d-51d2-4779-b9df-a33fa88bd792","2025-08-18 15:29:43.190421","Yes. Can you hear me?","Yes, I can hear you! I'm DK Metcalf, who is this?","False"
"d2508c4d-51d2-4779-b9df-a33fa88bd792","2025-08-18 15:29:56.350680","Data analyst.","Oh man, a data analyst! Thank goodness! I'm stuck on an asteroid, and I need to get home. How are you gonna get me out of here?","False"
"d2508c4d-51d2-4779-b9df-a33fa88bd792","2025-08-18 15:30:08.697443","I don't know yet.","Wait a minute... have we talked before? Did you contact me about the Psyche 23 mission?","False"
"d2508c4d-51d2-4779-b9df-a33fa88bd792","2025-08-18 15:30:23.659698","No. You called me","Look, this isn't some game, man, this is life or death out here and I'm freaking out! I'm stranded on an asteroid, and I need to know how you're going to rescue me. What's the plan?","False"
"d2508c4d-51d2-4779-b9df-a33fa88bd792","2025-08-18 15:31:41.939804","[An Event has occurred]: You try to turn on your wrist navigation device.","Okay, okay, deep breaths. What are you looking at on your end? Can you tell me what you're doing to try and locate me or figure out a rescue plan?","False"
"3244a070-cb75-41db-843d-c7623784c0ae","2025-08-18 13:59:23.054263","[An Event has occurred]: Someone has finally responded to your SOS broadcast!","Hello? ! Can you hear me?","False"
"3244a070-cb75-41db-843d-c7623784c0ae","2025-08-18 13:59:34.719482","I can hear you. Can you hear me?","Yes! I can hear you loud and clear! This is DK Metcalf, and I'm currently stranded out here.","False"
"6b1391c1-0785-42df-894a-0cd11eaf0bd2","2025-08-18 07:56:08.895984","[An Event has occurred]: Someone has finally responded to your SOS broadcast!","Hello? ! Can you hear me?!","False"
"6b1391c1-0785-42df-894a-0cd11eaf0bd2","2025-08-18 07:56:19.521315","Yes.","Yes! Thank the stars! This is DK Metcalf, and I'm stranded out here. Who is this?","False"
"363df1d6-a56e-4839-9ff4-dbc89a1a838e","2025-08-17 02:06:20.174636","[An Event has occurred]: Someone has finally responded to your SOS broadcast!","Hello? ! Can you hear me?","False"
"363df1d6-a56e-4839-9ff4-dbc89a1a838e","2025-08-17 02:06:28.156898","Hey, DK. Can you hear me?","Yes! My name is DK Metcalf.","False"
"5732c869-74dd-4c28-a031-5752f7cb22c9","2025-08-17 01:40:33.853001","[An Event has occurred]: Someone has finally responded to your SOS broadcast!","Hello? ! Can you hear me?!","False"
"5732c869-74dd-4c28-a031-5752f7cb22c9","2025-08-17 01:42:06.264385","I'm gonna send","What are you going to send? Are you sending help?","False"
"5732c869-74dd-4c28-a031-5752f7cb22c9","2025-08-17 01:42:21.139973","DK, is that you?","Yeah, it's DK! Who is this? Are you here to get me off this rock?","False"
"5732c869-74dd-4c28-a031-5752f7cb22c9","2025-08-17 01:42:33.099919","I'm the analyzer that you called earlier.","The analyzer? So you're the one who heard my SOS! How are you going to get me out of here? When can you send a ship?","False"
"5732c869-74dd-4c28-a031-5752f7cb22c9","2025-08-17 01:42:38.809808","[An Event has occurred]: You try to turn on your wrist navigation device.","What are you looking at right now? Can you tell me what you're seeing?","False"
"5732c869-74dd-4c28-a031-5752f7cb22c9","2025-08-17 01:42:52.320120","DK, where are you?","I'm still stuck on this asteroid, far from home. My wrist device isn't working, so I don't know my exact coordinates. You've got to help me get out of here!","False"
"5732c869-74dd-4c28-a031-5752f7cb22c9","2025-08-17 01:43:12.294280","What do you remember the last thing that happened?","The last thing I remember is getting kicked out of the Soyuz capsule by Barron. I was just floating, feeling battered, with my suit flashing critical damage warnings. Then I woke up and walked for what felt like days until I found this abandoned shelter.","False"
"5557715e-efa0-4c20-8b18-fbe18d94201d","2025-08-17 01:20:49.491389","[An Event has occurred]: Someone has finally responded to your SOS broadcast!","Hello? ! Can you hear me?","False"
"5557715e-efa0-4c20-8b18-fbe18d94201d","2025-08-17 01:20:57.421576","Yes. Can you hear me?","Yeah, I can hear you! My name's DK Metcalf.","False"
"5557715e-efa0-4c20-8b18-fbe18d94201d","2025-08-17 01:21:11.178429","Good to meet you.","Wait a minute... are you the NASA analyst I spoke to before this whole mission went down?","False"
"5557715e-efa0-4c20-8b18-fbe18d94201d","2025-08-17 01:21:24.590110","Yes. That's me.","Alright then, analyst. What's your plan for getting me off this rock? I'm not exactly seeing a shuttle bay around here, and I'm a little skeptical about what you can do from back on Earth.","False"
"5557715e-efa0-4c20-8b18-fbe18d94201d","2025-08-17 01:21:45.431438","Don't have a plan, but I'm trying to build one. One.","Well, I got here on some janky rocket, hoping to become a trillionaire. When we finally landed, it was a mess, but then I saw it: gold everywhere. More gold than I'd ever seen in my life, like giant hills of it just waiting to be mined.","False"
"5557715e-efa0-4c20-8b18-fbe18d94201d","2025-08-17 01:21:54.163771","","Man, the gold was something else. So pure. There was so much of it that when I used explosives, it was literally raining down on us. Just beautiful.","False"
"5557715e-efa0-4c20-8b18-fbe18d94201d","2025-08-17 01:22:05.929798","Cool stuff.","Yeah, it was incredible. What else do you need to know to get this rescue mission off the ground?","False"
"d30955fd-cef3-44b5-acbd-330ebf4910c4","2025-08-16 01:20:48.677525","See.","Hello? ! Can you hear me?!","False"
"c984ebb6-05c2-4274-9e1b-dfceb3ff2de7","2025-08-16 00:12:56.596660","No. No.","Hello? ! Can you hear me?!","False"
"c984ebb6-05c2-4274-9e1b-dfceb3ff2de7","2025-08-16 00:13:01.214878","","No? What do you mean? Are you there to help me, or are you just here to say 'no'?","False"
"252559c7-0fa6-41bd-b458-0af438d29636","2025-08-15 23:34:05.556090","[An Event has occurred]: Someone has finally responded to your SOS broadcast!","Hello? ! Can you hear me?!","False"
"da0cb47c-06b4-4d68-9d3e-48d4030a742d","2025-08-15 23:29:30.549308","[An Event has occurred]: Someone has finally responded to your SOS broadcast!","Hello? ! Can you hear me?","False"
"da0cb47c-06b4-4d68-9d3e-48d4030a742d","2025-08-15 23:30:57.578754","Okay. So it's the viewport the viewport","The viewport? What are you talking about? Are you going to get me out of here?","False"
"736e0df7-4a27-4169-9acf-9fb31539dbfc","2025-08-15 23:28:00.062372","[An Event has occurred]: Someone has finally responded to your SOS broadcast!","Hello? ! Can you hear me?","False"
"736e0df7-4a27-4169-9acf-9fb31539dbfc","2025-08-15 23:28:10.470242","Yes. Can you hear me?","Yes! It's DK Metcalf, who is this?","False"
"736e0df7-4a27-4169-9acf-9fb31539dbfc","2025-08-15 23:28:19.663632","My name is","It's good to hear from you! How are you going to get me out of here?","False"
"736e0df7-4a27-4169-9acf-9fb31539dbfc","2025-08-15 23:28:35.438981","Bob. Was wondering if you knew how many cakes you could carry.","I'm not sure how that's relevant right now, but I'm trying to get off this asteroid. Are you the NASA analyst I spoke to before this mission?","False"
"736e0df7-4a27-4169-9acf-9fb31539dbfc","2025-08-15 23:28:41.745515","","I'm not sure about cakes, but I can tell you I can carry a lot of candy! Right now, I'm just focused on getting off this asteroid.","False"
"736e0df7-4a27-4169-9acf-9fb31539dbfc","2025-08-15 23:29:00.763239","IDK. How are you?","IDK?! This isn't some game, Bob, this is life or death! I'm freaking out here. Are you going to help me or not?","False"
"736e0df7-4a27-4169-9acf-9fb31539dbfc","2025-08-15 23:29:07.885572","","How am I? I'm stranded on an asteroid, fighting for my life! This isn't a game. What do you need me to do to help you find me?","False"
"736e0df7-4a27-4169-9acf-9fb31539dbfc","2025-08-15 23:29:17.934045","[An Event has occurred]: You try to turn on your wrist navigation device.","Damn! My wrist device isn't working. It's supposed to have navigation and location, but it's dead.","False"
"fcad64c0-4fc7-46b8-8bc7-04402cf79742","2025-08-15 23:17:54.807661","[An Event has occurred]: Someone has finally responded to your SOS broadcast!","Hello? ! Can you hear me? Is anyone out there?","False"
"4cbe64c6-00e8-42c1-b1a9-89e2d7f20920","2025-08-15 23:12:17.060269","[An Event has occurred]: Someone has finally responded to your SOS broadcast!","Hello? ! Can you hear me? !","False"
"19a4b8ba-7961-4cb0-9e0b-7093e2de4602","2025-08-15 23:11:57.702377","Are you there, Dadek?","Hello? ! Can you hear me?","False"
"19a4b8ba-7961-4cb0-9e0b-7093e2de4602","2025-08-15 23:12:02.326758","","It's DK Metcalf, and I'm definitely here! Who is this? Are you here to help me?","False"
"00b2e54a-b700-4162-9850-bac37a022e08","2025-08-15 23:10:24.754303","[An Event has occurred]: Someone has finally responded to your SOS broadcast!","Hello? ! Can you hear me? I can't believe someone actually responded to my SOS!","False"
"00b2e54a-b700-4162-9850-bac37a022e08","2025-08-15 23:10:44.422271","Yeah. I can hear you, DK. I can hear","Yeah, that's me, DK Metcalf. I'm stranded out here on this asteroid and I've You been sending can hear me? out an Good. SOS Is this... for what feels like forever. Who is this, and how are you is gonna this get who me out I of talked to here?","False"
"00b2e54a-b700-4162-9850-bac37a022e08","2025-08-15 23:10:52.796607","","before the mission? Are you the one who set up this whole trip?","False"
"00b2e54a-b700-4162-9850-bac37a022e08","2025-08-15 23:11:02.151632","[An Event has occurred]: You try to turn on your wrist navigation device.","I tried to turn on my wrist device to get a read on my location, but it's not working. I knew I couldn't trust that thing. Just another dead end out here.","False"
"00b2e54a-b700-4162-9850-bac37a022e08","2025-08-15 23:11:26.664529","Man, that's a shame. Still there? Okay.","Yeah, I'm still here. What exactly are you looking at right now? Are you seeing anything that can help locate me or figure out a way home from this asteroid?","False"
"00b2e54a-b700-4162-9850-bac37a022e08","2025-08-15 23:11:37.079508","Yeah. I'm looking I'm looking.","Okay, you're looking at something. Can you explain what you're doing? Is it something that can help me get off this rock?","False"
"9079c12c-74be-4871-9ee3-14c248072fb7","2025-08-15 23:04:01.481799","[An Event has occurred]: Someone has finally responded to your SOS broadcast!","Hello? ! Can you hear me?!","False"
"9079c12c-74be-4871-9ee3-14c248072fb7","2025-08-15 23:04:16.663890","Hello? Hello?","Yes! I can hear you! This is DK Metcalf, I'm stranded out here on Psyche 23. Who is this?","False"
"9079c12c-74be-4871-9ee3-14c248072fb7","2025-08-15 23:04:21.576419","","Wait a minute, is this who I think it is? Is this the person I spoke to before the mission?","False"
"9079c12c-74be-4871-9ee3-14c248072fb7","2025-08-15 23:04:37.246512","Okay. So","Okay... so who is this? Are you here to get me off this asteroid? I've been stranded for what feels like days.","False"
"9079c12c-74be-4871-9ee3-14c248072fb7","2025-08-15 23:04:40.638056","","So, is it you? How did you find me out here?","False"
"07311f3c-0e33-446d-8ba1-c6a85d05fa3a","2025-08-15 23:00:36.561091","[An Event has occurred]: Someone has finally responded to your SOS broadcast!","Hello? ! Can you hear me? !","False"
"07311f3c-0e33-446d-8ba1-c6a85d05fa3a","2025-08-15 23:00:44.188751","I can hear you.","Oh man, this","False"
"07311f3c-0e33-446d-8ba1-c6a85d05fa3a","2025-08-15 23:00:53.274375","Who's talking?","Wait a minute, I recognize that voice! Is this you, the person I spoke to before the mission?","False"
"07311f3c-0e33-446d-8ba1-c6a85d05fa3a","2025-08-15 23:01:07.551137","No. It's not. Why did this pop up? I didn't do anything.","This isn't some game,","False"
"07311f3c-0e33-446d-8ba1-c6a85d05fa3a","2025-08-15 23:01:16.605611","No. It's not the same person.","Okay, my mistake. I'm just relieved to hear someone out here. What can I do to help you find me?","False"
"07311f3c-0e33-446d-8ba1-c6a85d05fa3a","2025-08-15 23:01:32.460359","Well, where are you, bud?","I'm on an asteroid, but my navigation device is busted, so I don't know my exact coordinates. You'll need to reconstruct data from the mission to locate me and send a rescue ship.","False"
"07311f3c-0e33-446d-8ba1-c6a85d05fa3a","2025-08-15 23:01:57.361375","Okay. That works better.","Alright, that's great!","False"
"07311f3c-0e33-446d-8ba1-c6a85d05fa3a","2025-08-15 23:02:01.063613","Why is it still here?","Because I'm still stuck here,","False"
"07311f3c-0e33-446d-8ba1-c6a85d05fa3a","2025-08-15 23:02:13.263198","Oh, thirty I mean, it's into the mission time. Hey, DK. What does your","I didn't quite catch that. What were you saying? I'm still out here, and we need to figure out how to get me back to Earth.","False"
"07311f3c-0e33-446d-8ba1-c6a85d05fa3a","2025-08-15 23:02:21.911309","","Right now, I'm holed up in what looks like an abandoned shelter from another mining expedition. It's pretty dusty in here, but at least I found some equipment to send out my SOS.","False"
"07311f3c-0e33-446d-8ba1-c6a85d05fa3a","2025-08-15 23:02:39.683056","Cool.","Yeah, it's something, I guess. So, about that mission data you needed to reconstruct my whereabouts, what exactly are you looking for? I'm ready to tell you everything I remember to help you find me.","False"
"07311f3c-0e33-446d-8ba1-c6a85d05fa3a","2025-08-15 23:02:50.024925","[An Event has occurred]: You try to turn on your wrist navigation device.","My wrist device isn't working, it hasn't been since I landed. What are you looking at on your end? Can you explain what you're doing to try","False"
"07311f3c-0e33-446d-8ba1-c6a85d05fa3a","2025-08-15 23:03:08.389453","Yeah. I'm trying to find you. I'm analyzing some data in a recreation. I'm looking at some people Yeah.","People, you say? Are they the folks from my mission? Tell me, what do they look like and what are","False"
"07311f3c-0e33-446d-8ba1-c6a85d05fa3a","2025-08-15 23:03:18.404532","I think so.","Interesting. Can you tell me more about who you're seeing? Like, are Hoss, Barron, or Anna there? What are they doing in this recreation?","False"
"07311f3c-0e33-446d-8ba1-c6a85d05fa3a","2025-08-15 23:03:32.923343","Yeah. Well, we'll like one of them's got a big diamond. I don't know what the other one's doing. Kinda at least lying there dead, I think.","A big diamond? And","False"
"07311f3c-0e33-446d-8ba1-c6a85d05fa3a","2025-08-15 23:03:47.822781","No. That's the wrong that's the wrong audio file.","Understood. My bad, I'm just eager to get this rescue moving. So, what exactly are you seeing in that recreation now that could help you pinpoint my location?","False"
"890fae91-b97a-4688-80a4-3f388a66fb40","2025-08-15 21:48:40.143380","[An Event has occurred]: Someone has finally responded to your SOS broadcast!","Hello? ! Can you hear me? !","False"
"890fae91-b97a-4688-80a4-3f388a66fb40","2025-08-15 21:48:52.610082","Guess I can hear you.","Oh man, that's a relief! My name's DK Metcalf, and I'm currently stranded out here on this asteroid.","False"
"54a56096-2c7a-449a-a229-21fbd826304f","2025-08-15 21:15:16.366167","[An Event has occurred]: Someone has finally responded to your SOS broadcast!","Hello? ! Can you hear me?!","False"
"54a56096-2c7a-449a-a229-21fbd826304f","2025-08-15 21:15:43.266715","Hey, DK. How's it hanging?","It's hanging, alright, considering I'm DK Metcalf and stranded out here! Who is this?","False"
"54a56096-2c7a-449a-a229-21fbd826304f","2025-08-15 21:16:13.852348","That one wasn't just me.","Wait a minute... Is that you, from before the mission? Who else is with you?","False"
"54a56096-2c7a-449a-a229-21fbd826304f","2025-08-15 21:16:24.720946","We","''We''? Who exactly is this, and how are you gonna get me out of here?","False"
"54a56096-2c7a-449a-a229-21fbd826304f","2025-08-15 21:18:40.833053","right.","Alright then. So, what exactly do you know about space rescue? This isn't exactly a walk in the park, and I'm not sure you're the right person to get me out of this.","False"
"4d72b2b6-ec24-4cd4-a9c4-f091eb56d1b4","2025-08-15 20:32:42.296332","Something to good to pay.","Hello? ! Can you hear me?","False"
"a5255147-0f19-4f52-b92e-8845933c492c","2025-08-15 20:25:45.738483","Because of the money to","Hello? ! Can you hear me? Is someone actually out there?!","False"
"bd8bbf78-51bc-44b7-a7b4-c7141bf9badc","2025-08-15 19:27:26.556366","[An Event has occurred]: Someone has finally responded to your SOS broadcast!","Hello? ! Can you hear me?!","False"
"bd8bbf78-51bc-44b7-a7b4-c7141bf9badc","2025-08-15 19:27:44.797631","Hello, DK. Can you hear me?","Yes, I can hear you! My name is DK Metcalf. Who is this?","False"
