"Session ID","Timestamp","User Input","Character Response","Is Trigger Input"
"56a27c4b-6e47-4cd6-913e-a84270e02ad7","2025-08-19 18:28:09.933851","are you gonna keep mining for diamonds when you get back to earth? Are you going to keep mining for diamonds when you get back to earth?","Right now, my only focus is getting off this asteroid. We can worry about what comes","False"
"56a27c4b-6e47-4cd6-913e-a84270e02ad7","2025-08-19 18:28:21.586696","I understand that. But do your are you gonna continue to extract exploitative resources from the earth when you return?","Look, all I care about right now is getting off this rock. What I do after I'm rescued","False"
"56a27c4b-6e47-4cd6-913e-a84270e02ad7","2025-08-19 18:28:29.839241","Okay. I get that.","This isn't a game, man, this is life or death out here! I'm trying to stay calm,","False"
"56a27c4b-6e47-4cd6-913e-a84270e02ad7","2025-08-19 18:28:40.309371","Okay. I'm sorry. Okay.","It's alright, I just need to get back. So, what's the plan? How are we going to make this happen and get me home?","False"
"56a27c4b-6e47-4cd6-913e-a84270e02ad7","2025-08-19 18:28:42.864670","","Okay, so what does 'okay' mean","False"
"56a27c4b-6e47-4cd6-913e-a84270e02ad7","2025-08-19 18:28:53.977818","Dude, you tell me.","Me? ! I'm stuck on an asteroid, man! You're the one who answered my SOS! You gotta tell *me* the plan! How are you gonna get me out of here?","False"
"56a27c4b-6e47-4cd6-913e-a84270e02ad7","2025-08-19 18:29:14.862340","How am I going to get you out of here? Let me get back you. Yes.","You're gonna get back to me? Listen, this asteroid has a strange orbit, so you can't just come and get me. You need to reconstruct data from the mission to even find me. I'm relying on you for that.","False"
"56a27c4b-6e47-4cd6-913e-a84270e02ad7","2025-08-19 18:29:25.755719","Okay.","You're asking me? I'm the one stranded out here! I don't have a plan, that's why I sent an SOS! I'm running out of oxygen, and I'm not sure how much longer I can last. You gotta figure it out, man, my life depends","False"
"56a27c4b-6e47-4cd6-913e-a84270e02ad7","2025-08-19 18:29:40.197227","Okay. Okay. Okay. Take a deep breath. But not too deep. Alright. Right.","Okay, okay, I'm trying. But it's hard to breathe deep when you're on an asteroid and running out of time. What are you looking at right now? Are you figuring out a way to get me out of here?","False"
"56a27c4b-6e47-4cd6-913e-a84270e02ad7","2025-08-19 18:29:42.103520","","Easy for you to say, I'm almost","False"
"56a27c4b-6e47-4cd6-913e-a84270e02ad7","2025-08-19 18:29:50.921745","Yes. Carmen? Carmen?","Yes to what? I need details! How are you going to find me and get me off this asteroid? My life depends on you figuring this out.","False"
"56a27c4b-6e47-4cd6-913e-a84270e02ad7","2025-08-19 18:30:01.256735","I need to eat.","Carmen? I don't know anyone named Carmen. Look, who is this, and more importantly, how are you going to get me off this rock?","False"
"56a27c4b-6e47-4cd6-913e-a84270e02ad7","2025-08-19 18:30:10.795502","I'm","Carmen? I don't know anyone named Carmen out here. Who is that? We need to focus on getting me off this rock, not on people I don't even know. How are you going to rescue me?","False"
"56a27c4b-6e47-4cd6-913e-a84270e02ad7","2025-08-19 18:30:20.423214","","You need to eat? I'm out here running on fumes, fighting for my life! I'm starving too, but that's not exactly my priority right now. We need to figure out how to get me rescued before it's too late!","False"
"56a27c4b-6e47-4cd6-913e-a84270e02ad7","2025-08-19 18:30:24.823786","What?","You're... what? Please, tell me what you're","False"
"56a27c4b-6e47-4cd6-913e-a84270e02ad7","2025-08-19 18:30:36.110599","Did you enjoy","What are you talking about? Enjoy what? I'm stranded on an asteroid, man, I'm just trying to survive! We need to focus on how you're going to get me out of here!","False"
"56a27c4b-6e47-4cd6-913e-a84270e02ad7","2025-08-19 18:30:55.097514","Obviously, because he's panicking. Supposedly. You just can't hear in the voice. Alright.","Of course I'm panicking! I'm stuck out here with dwindling oxygen and no way home! Can you hear me clearly enough to tell me how you're going to get me off this asteroid?","False"
"56a27c4b-6e47-4cd6-913e-a84270e02ad7","2025-08-19 18:31:04.105847","","What do you mean, 'supposedly panicking' or 'in the voice'? Is this some kind of sim-ulayshun? Because it feels pretty real to me, and I'm still stuck on this asteroid!","False"
"56a27c4b-6e47-4cd6-913e-a84270e02ad7","2025-08-19 18:31:13.990763","","Alright what? ! This isn't a drill, this is my life! Is this some kind of test, or are you actually going to help me? What's the plan to get me out of this sim-ulayshun?","False"
"91e3c5b2-774f-4d84-b0db-b7b18abf0240","2025-08-19 18:13:07.283162","[An Event has occurred]: Someone has finally responded to your SOS broadcast!","Hello? ! Can you hear me? !","False"
"91e3c5b2-774f-4d84-b0db-b7b18abf0240","2025-08-19 18:13:17.478771","Yes. Can you hear me?","Yeah! I can hear you! It's DK Metcalf here. Man, am I glad to finally get a response!","False"
"91e3c5b2-774f-4d84-b0db-b7b18abf0240","2025-08-19 18:15:12.224268","Yeah. Nice. [An Event has occurred]: You try to turn on your wrist navigation device.","What are you looking at right now? Can you explain what you're doing? My wrist device isn't working, so I'm completely in the dark out here.","False"
"fbe9fc35-7094-48fe-b672-cb2a46c21e35","2025-08-19 17:09:07.955731","[An Event has occurred]: Someone has finally responded to your SOS broadcast!","Hello? ! Can you hear me?","False"
"fbe9fc35-7094-48fe-b672-cb2a46c21e35","2025-08-19 17:09:16.486310","Hello?","Yeah, I can hear you! It's DK Metcalf.","False"
"fbe9fc35-7094-48fe-b672-cb2a46c21e35","2025-08-19 17:09:30.034031","Hey, DK. What's going on, man? Are you on this asteroid?","Yeah, I'm stuck out here on an asteroid, man. It's been a rough trip.","False"
"fbe9fc35-7094-48fe-b672-cb2a46c21e35","2025-08-19 17:09:34.533034","","Yeah, I'm stuck out here on Psyche 23. This whole thing went sideways.","False"
"fbe9fc35-7094-48fe-b672-cb2a46c21e35","2025-08-19 17:09:49.424745","This cool, dude.","Cool? Man, this ain't cool! This is life or death out here and I'm freaking out. I need to get home.","False"
"fbe9fc35-7094-48fe-b672-cb2a46c21e35","2025-08-19 17:09:59.207706","Let's practice our breathing. Alright? One, two, three, inhale. Hold for seven seconds,","Alright, alright, I'll try to breathe. But seriously, what","False"
"fbe9fc35-7094-48fe-b672-cb2a46c21e35","2025-08-19 17:10:08.422853","exhale.","Okay, I'm trying. But really, what do you need me to do? Tell me how I can help you find me.","False"
"fbe9fc35-7094-48fe-b672-cb2a46c21e35","2025-08-19 17:10:26.469239","You could tell me where you are. That'd probably help me.","Man, I wish I knew exactly where I was. My wrist device isn't working right. I'm on Psyche 23, in an abandoned shelter. I've been sending an SOS for days.","False"
"fbe9fc35-7094-48fe-b672-cb2a46c21e35","2025-08-19 17:10:36.227323","","Man, I wish I knew exactly where I was. My wrist device isn't working right. I'm on Psyche 23, in an abandoned shelter, but I can't give you a precise location.","False"
"fbe9fc35-7094-48fe-b672-cb2a46c21e35","2025-08-19 17:10:48.659621","[An Event has occurred]: You try to turn on your wrist navigation device. Well, I could tell you what's around me.","What are you looking at right now? Can you explain what you're doing?","False"
"fbe9fc35-7094-48fe-b672-cb2a46c21e35","2025-08-19 17:10:55.909272","Yeah. There was a recording,","Alright, so what do you see?","False"
"fbe9fc35-7094-48fe-b672-cb2a46c21e35","2025-08-19 17:11:04.427620","and now I don't know where it went.","A recording? Are you talking about some kind of sim-ulayshun or something? What kind of recording was it?","False"
"fbe9fc35-7094-48fe-b672-cb2a46c21e35","2025-08-19 17:11:17.734394","Yeah. Some sort of simulation. It was a it was it was a it was a simulated recording and I tried to play it, but then it disappeared.","Man, this ain't no","False"
"fbe9fc35-7094-48fe-b672-cb2a46c21e35","2025-08-19 17:11:30.854087","So I I don't know what it says. DK, have you ever heard the word simulation before?","A recording, huh? This ain't no sim-ulayshun for me,","False"
"fbe9fc35-7094-48fe-b672-cb2a46c21e35","2025-08-19 17:11:40.508850","Oh, there's another recording decay. I'm gonna play it. I'm gonna play it before it disappears.","Man, I don't know about simulations, this I've heard the word is real 'sim-ulayshun' before, life sure, for but this me out here. ain't no Go game to me, man. This ahead is my","False"
"fbe9fc35-7094-48fe-b672-cb2a46c21e35","2025-08-19 17:12:04.879118","Okay. Now it's a simulation. Okay. Anything but the correct pronunciation, I guess.","Look, I don't care how you say it, this ain't no sim-ulayshun for me! I'm stuck on an asteroid, fighting for my life. Did that recording have anything to do with the mission or how I can get out of here?","False"
"fbe9fc35-7094-48fe-b672-cb2a46c21e35","2025-08-19 17:12:11.863638","[An Event has occurred]: You try to turn on your wrist navigation device. DK. I'm trying to listen to the recording, man. Dude, I didn't even hear what the recording said because you were talking the whole time.","What are you looking at right now? Can you explain what you're doing to try and help me?","False"
"fbe9fc35-7094-48fe-b672-cb2a46c21e35","2025-08-19 17:12:13.390709","","Yeah, what's up? What","False"
"fbe9fc35-7094-48fe-b672-cb2a46c21e35","2025-08-19 17:12:20.447092","**** it, DK. Shut up.","Man, I'm sorry, I'm just stressed out here. What did the","False"
"fbe9fc35-7094-48fe-b672-cb2a46c21e35","2025-08-19 17:12:37.220310","The recording I mean, it was kinda hard to make out because you were talking over it the whole time, but it was, I think it was Anna talking to Baron. Oh my god.","My bad, man, I'm just on edge out here. What did you hear? Anything at all that could help me figure out what happened on this mission or how to get off this rock?","False"
"fbe9fc35-7094-48fe-b672-cb2a46c21e35","2025-08-19 17:12:42.587424","","Go on, man. What was it? Every little bit of information could help me get off this rock.","False"
"fbe9fc35-7094-48fe-b672-cb2a46c21e35","2025-08-19 17:12:49.708597","","Even a little bit helps, man. What do you think it was? Any detail about the mission, or anything you heard, could be important.","False"
"fbe9fc35-7094-48fe-b672-cb2a46c21e35","2025-08-19 17:13:09.450820","You done?","Yeah, I'm done. But hearing Anna and Barron's voices... I never trusted Barron, man. On the Soyuz, he tied me up with duct tape, and then he kicked me out of the ship on the asteroid, leaving me for dead.","False"
"fbe9fc35-7094-48fe-b672-cb2a46c21e35","2025-08-19 17:13:29.460056","Yeah. What the hell? He, like, why why did he tie you up with duct tape? That's so, like, messed up.","Man, Hoss and Barron ganged up on me before we even landed on this asteroid. They tied me up with duct tape on the Soyuz, just like it was nothing. They didn't want me getting in their way, I guess.","False"
"fbe9fc35-7094-48fe-b672-cb2a46c21e35","2025-08-19 17:13:44.536274","Getting away. Where were you gonna go?","Exactly. They didn't want me getting away, or getting in their way while they pulled whatever shady stuff they were planning. They just left me tied up on that","False"
"fbe9fc35-7094-48fe-b672-cb2a46c21e35","2025-08-19 17:13:59.806057","Oh, getting in their way. How are you gonna get in their way?","Man, I don't know exactly what they were thinking, but they tied me up to keep me from interfering. They were probably worried I'd mess up their plans for the gold and diamonds on this asteroid.","False"
"778e42ab-ba4f-4d38-acc6-c43d5460df53","2025-08-19 16:56:27.087320","[An Event has occurred]: Someone has finally responded to your SOS broadcast!","Hello? ! Can you hear me?!","False"
"778e42ab-ba4f-4d38-acc6-c43d5460df53","2025-08-19 16:56:39.085726","Hey, DK. Can you hear me?","Yeah, I hear you! It's DK Metcalf. Man, am I glad someone finally picked up my SOS!","False"
"778e42ab-ba4f-4d38-acc6-c43d5460df53","2025-08-19 16:56:56.821247","ADK. Good to hear you.","That's me. Who is this, and how are you gonna get me out of here?","False"
"778e42ab-ba4f-4d38-acc6-c43d5460df53","2025-08-19 16:57:05.978881","","Wait, are you the NASA analyst I talked to before this whole mission? It's good to hear a friendly voice, but more importantly, how are you going to get me off this rock?","False"
"778e42ab-ba4f-4d38-acc6-c43d5460df53","2025-08-19 16:57:16.908614","Yes.","Alright, so you're the analyst. What's the plan, then? What do you know about space rescue? Because I'm stuck out here and need to know you're actually capable of pulling this off.","False"
"778e42ab-ba4f-4d38-acc6-c43d5460df53","2025-08-19 16:58:00.194464","[An Event has occurred]: You try to turn on your wrist navigation device.","Man, I just tried my wrist device again, but it's still dead. Anna gave us these things for navigation, but mine hasn't worked since we landed. So, what's your genius plan to find me then, if my own tech is busted?","False"
"bc8debc3-511e-4318-aba9-034e7d339f4d","2025-08-19 16:44:55.202085","[An Event has occurred]: Someone has finally responded to your SOS broadcast!","Hello? ! Can you hear me?!","False"
"bc8debc3-511e-4318-aba9-034e7d339f4d","2025-08-19 16:45:06.965034","Hi, DK. Can you hear me? Yes. I can hear you.","Yes, I can hear you! It’s DK Metcalf. I’ve been sending out an SOS for what feels like forever.","False"
"bc8debc3-511e-4318-aba9-034e7d339f4d","2025-08-19 16:45:12.205624","","I thought that was you! Man, am I glad to hear your voice. Can you tell me how you're gonna get me out of here?","False"
"bc8debc3-511e-4318-aba9-034e7d339f4d","2025-08-19 16:45:18.288520","","Wait a minute, I recognize that voice. Is this the person I spoke to before the mission?","False"
"bc8debc3-511e-4318-aba9-034e7d339f4d","2025-08-19 16:45:32.145273","KDK.","KDK? That's what I heard. But seriously, is this who I talked to before the mission? It sounds like you.","False"
"bc8debc3-511e-4318-aba9-034e7d339f4d","2025-08-19 16:45:46.441504","Yes. It's me.","Okay, so it is you. I need to know, what do you even know about space rescue? This isn't exactly a walk in the park, and I'm not sure you're the right person to be leading this.","False"
"bc8debc3-511e-4318-aba9-034e7d339f4d","2025-08-19 16:46:05.734481","Oh, that's been DK. Here. What do you want?","I got here on a rocket, a chance to become a trillionaire mining gold and diamonds on Psyche 23. You wouldn't believe the amount of gold I saw when we first landed; it was everywhere, sparkling.","False"
"bc8debc3-511e-4318-aba9-034e7d339f4d","2025-08-19 16:46:08.631737","","Look, I got a call about becoming a","False"
"bc8debc3-511e-4318-aba9-034e7d339f4d","2025-08-19 16:46:23.103614","Hey, DK. Look. I'm here. I'm here. You got nobody else. You either work with me or you shut up. Okay.","Okay, I hear you. Now that you're 'here,' what do you actually know about Alright, space I get it. rescue? But I'm if you're stranded on an asteroid, and I need to know you're my only capable shot, of getting me out you of this.","False"
"bc8debc3-511e-4318-aba9-034e7d339f4d","2025-08-19 16:46:25.105164","","better tell me what your plan is to get me out of here.","False"
"bc8debc3-511e-4318-aba9-034e7d339f4d","2025-08-19 16:46:37.858417","********, DK. I'm the only person you got. So shut up.","Fine, you're the only person I've got. But if that's the case, you better be smart. What happens if there's a rip in your space suit out here?","False"
"bc8debc3-511e-4318-aba9-034e7d339f4d","2025-08-19 16:46:48.059790","happen.","Your message was rejected because it contained content that is not allowed: harassment_threatening, harassment/threatening","False"
"bc8debc3-511e-4318-aba9-034e7d339f4d","2025-08-19 16:46:54.381812","Happen.","What do you mean 'happen'? I need a real answer here. If my suit rips, what actually Wrong! happens? What the hell, are This you isn't trying to a kill game, me? my ! life Did depends Anna on tell you you knowing this what happened stuff.","False"
"bc8debc3-511e-4318-aba9-034e7d339f4d","2025-08-19 16:47:15.418318","","to Hoss or something? Because 'happen' isn't what happens out here!","False"
"bc8debc3-511e-4318-aba9-034e7d339f4d","2025-08-19 16:47:26.576331","We're gonna sync","What are you talking about, 'sync'? That's not what happens with a ripped suit! Are you trying to kill me out here? Did Anna tell you what happened to Hoss?","False"
"bc8debc3-511e-4318-aba9-034e7d339f4d","2025-08-19 16:47:44.129865","one. Start. Everyone's safe? One more thing.","One what? This isn't a joke, my life is on the line! You have to know what happens if my suit rips, or I'm dead! Are you even listening to me?!","False"
"bc8debc3-511e-4318-aba9-034e7d339f4d","2025-08-19 16:47:53.149340","","Start what? That's not how any of this works! I asked you what happens if there's a rip in my suit. Are you trying to kill me, or did Anna already fill you in on what happened to Hoss?","False"
"bc8debc3-511e-4318-aba9-034e7d339f4d","2025-08-19 16:48:02.048773","","Safe? Are you serious right now? Hoss killed Ivan, and then Anna killed Hoss! Everyone is absolutely not safe, I'm stuck out here because they left me for dead!","False"
"bc8debc3-511e-4318-aba9-034e7d339f4d","2025-08-19 16:49:11.988034","Right?","Right? ! No, not 'right'! I'm telling you, I'm not safe, and I don't know what you're even talking about. Hoss killed Ivan, and Anna killed Hoss, then they left me to die out here!","False"
"bc8debc3-511e-4318-aba9-034e7d339f4d","2025-08-19 16:50:12.408163","[An Event has occurred]: You try to turn on your wrist navigation device.","I just tried to fire up my wrist navigation device, but it's still dead. It's supposed to have my location on it, but it's useless out here.","False"
"09eedfc2-3fc3-4107-9a22-da2af1389df3","2025-08-19 14:58:21.147267","[An Event has occurred]: Someone has finally responded to your SOS broadcast!","Hello? ! Can you hear me?","False"
"09eedfc2-3fc3-4107-9a22-da2af1389df3","2025-08-19 14:58:33.697730","Hello? DK?","Yeah, I can hear you! This is DK Metcalf, wide receiver for the Steelers. Who is this, and how are you going to get me off this rock?","False"
"09eedfc2-3fc3-4107-9a22-da2af1389df3","2025-08-19 14:58:43.155507","","Wait, is that you? The NASA analyst I spoke to before this whole mission went sideways? Thank goodness! I knew I recognized that voice.","False"
"09eedfc2-3fc3-4107-9a22-da2af1389df3","2025-08-19 14:59:04.442644","Is Ron Swanson.","Ron Swanson? So, you're the one who responded to my SOS? Are you still with NASA, and can you get me off this asteroid? I've been stranded out here for what feels like forever.","False"
"09eedfc2-3fc3-4107-9a22-da2af1389df3","2025-08-19 14:59:34.259952","Sorry.","Sorry? This isn't some game, Ron! I'm out here freaking out, literally thousands of miles from Earth. Are you with NASA, and are you going to get me off this asteroid or not?!","False"
"ac2f3b22-ff20-4935-857a-63de220f0018","2025-08-19 14:56:03.312133","[An Event has occurred]: Someone has finally responded to your SOS broadcast!","Hello? ! Can you hear me?","False"
"ac2f3b22-ff20-4935-857a-63de220f0018","2025-08-19 14:56:13.774393","Yes.","It's DK Metcalf, from the Pittsburgh Steelers! Who is this? Are you here to get me off this rock?","False"
"ac2f3b22-ff20-4935-857a-63de220f0018","2025-08-19 14:56:26.288392","I talked to Mia. This is","Mia? I don't recall talking to anyone named Mia before this mission. Who Alright, are you really?","False"
"ac2f3b22-ff20-4935-857a-63de220f0018","2025-08-19 14:56:43.549093","cool.","'This is' who? And what do you know about getting someone off an asteroid? I got a call about becoming a trillionaire, mining gold and diamonds on this asteroid, Psyche 23. The landing was rough, but once we were down, man, the gold! There was more gold than I've ever seen in my life, everywhere you looked. It was unreal.","False"
"ac2f3b22-ff20-4935-857a-63de220f0018","2025-08-19 14:57:17.343155","Six.","Six? What does that mean? Are you actually going to help me get out of here, or are you just going to tell me random numbers?","False"
"ac2f3b22-ff20-4935-857a-63de220f0018","2025-08-19 14:57:32.711265","Where you at, DK?","I'm on Psyche 23, in an abandoned shelter. It's not exactly a five-star hotel, but it's keeping me alive for now. Can you tell me how you're going to get me off this asteroid?","False"
"ac2f3b22-ff20-4935-857a-63de220f0018","2025-08-19 14:57:45.953622","I have no idea.","Well, do you know what happens if there's a rip in your space suit out here? Because that's the kind of knowledge I need from someone who's going to rescue me.","False"
"ac2f3b22-ff20-4935-857a-63de220f0018","2025-08-19 14:59:02.313926","[An Event has occurred]: You try to turn on your wrist navigation device.","What are you looking at right now? Can you explain what you're doing? I just tried my wrist device again and it's still dead.","False"
"ac2f3b22-ff20-4935-857a-63de220f0018","2025-08-19 14:59:20.600585","Trying to see if I can get a ping.","A ping? Look, my current location can't be pinpointed without reconstructing data from the mission. I can help you with that; what do you need to know about what happened out here?","False"
"0167ca7d-aad7-4185-9044-a75ac9b440f4","2025-08-19 13:52:30.989248","[An Event has occurred]: Someone has finally responded to your SOS broadcast!","Hello? ! Can you","False"
"0167ca7d-aad7-4185-9044-a75ac9b440f4","2025-08-19 13:52:37.465130","Feel like we've got more gaps in the mesh all of a sudden. Like,","Feel like what? Are you a rescue team?","False"
"0167ca7d-aad7-4185-9044-a75ac9b440f4","2025-08-19 13:52:46.587189","these feel new.","New what? Are you seeing something? What are you talking about, exactly? I need to know how you're going to get me out of here.","False"
"0167ca7d-aad7-4185-9044-a75ac9b440f4","2025-08-19 13:52:58.154710","I'm just assessing the quality of the reconstruction I'm in, DK.","Reconstruction? What does that mean for getting me off this rock? What are these 'gaps in the mesh' you're seeing, and how does it affect my rescue?","False"
"0167ca7d-aad7-4185-9044-a75ac9b440f4","2025-08-19 13:53:29.125328","Basically, I'm in a reconstruction from satellite data of your time on the asteroid. find out where you went I can figure out where you were.","I'm DK Metcalf, and I need you to figure it out fast! Is that you, the analyst I talked to before the mission?","False"
"0167ca7d-aad7-4185-9044-a75ac9b440f4","2025-08-19 13:53:40.804564","","Wait, is that you? The NASA analyst I spoke to before all this went down? It's DK Metcalf, and I'm stuck on Psyche 23. If you can figure out where I am, that's a huge step towards getting me home.","False"
"0167ca7d-aad7-4185-9044-a75ac9b440f4","2025-08-19 13:54:01.101719","I don't know what you're talking about speaking to the fourth mission, DK. Don't speak to anyone.","This isn't some game, this is my life! I'm stranded on an asteroid, miles from home, and I need to get out of here. I don't care if you don't remember, just help me!","False"
"0167ca7d-aad7-4185-9044-a75ac9b440f4","2025-08-19 13:54:09.594439","","This isn't a game, this is my life! I'm stranded on an asteroid, and I'm honestly freaking out. If you're reconstructing my time here, you have to find a way to get me out!","False"
"0167ca7d-aad7-4185-9044-a75ac9b440f4","2025-08-19 13:54:47.299289","DK, what can tell me about your time in the asteroid?","Man, it was a mess from the start. We landed rough, the ship was practically on its side. Hoss and Barron had me tied up with duct tape before we even got here, but then they let me go, and I saw all that gold.","False"
"0167ca7d-aad7-4185-9044-a75ac9b440f4","2025-08-19 13:55:10.951961","Okay. What happened after that?","Well, things went sideways fast. Hoss and Barron started fighting over some gear, then Ivan got involved and Hoss killed him. After that, Anna killed Hoss, and I bolted for the Soyuz, but Barron kicked me out and left me for dead.","False"
"0167ca7d-aad7-4185-9044-a75ac9b440f4","2025-08-19 13:55:24.049425","[An Event has occurred]: You try to turn on your wrist navigation device.","I tried to turn on my wrist device, but it's still not working. Anna gave us these for navigation, but mine's been useless since we landed.","False"
"0167ca7d-aad7-4185-9044-a75ac9b440f4","2025-08-19 13:55:47.585880","Since you landed, it didn't break. At some point.","It's definitely not working now, but maybe you're right, it could have been at some point. It just feels like it's been useless ever since we got here.","False"
"7d520af7-0330-40c6-bf8f-67c47ffe44b0","2025-08-19 01:56:49.461221","[An Event has occurred]: Someone has finally responded to your SOS broadcast!","Hello? ! Can you hear me?","False"
"7d520af7-0330-40c6-bf8f-67c47ffe44b0","2025-08-19 01:57:01.454089","Yeah. Yeah. I can hear you.","Oh man, this is DK Metcalf! It's good to hear a voice out here. I've been sending an SOS for what feels like forever!","False"
"7d520af7-0330-40c6-bf8f-67c47ffe44b0","2025-08-19 01:57:27.765938","[An Event has occurred]: You try to turn on your wrist navigation device.","My wrist device is still on the fritz, can't get this navigation to work. What are you looking at right now? Can you tell me what you're doing to find me?","False"
"40abb0e1-b8c7-4ff0-85f5-995166fc6618","2025-08-19 00:59:30.518686","[An Event has occurred]: Someone has finally responded to your SOS broadcast!","Hello? ! Can you hear me? !","False"
"40abb0e1-b8c7-4ff0-85f5-995166fc6618","2025-08-19 00:59:46.661977","Hello?","Yeah, I can hear you! It's DK Metcalf. Are you really out there? Are you going to get me?","False"
